filename,year,date,announcement,page,paragraph_id,text,sentiment
Pronunciamiento_Subnacional_2024_240624.pdf,2024.0,5 de julio de 2024,,6,31,"Finalmente, el CF recomienda incluir en el IAECRF una sección dedicada al seguimiento de las finanzas públicas de aquellos gobiernos locales que presentan el incumplimiento recurrente de la regla de SDT y que mantienen en niveles elevados de deuda desde hace varios años. Esto se debería complementar con el seguimiento de aquellos gobiernos subnacionales que podrían entrar en esta situación a corto o mediano plazo, con un análisis más prospectivo y no sólo retrospectivo sobre posibles riesgos fiscales.","{'sequence': 'Finalmente, el CF recomienda incluir en el IAECRF una sección dedicada al seguimiento de las finanzas públicas de aquellos gobiernos locales que presentan el incumplimiento recurrente de la regla de SDT y que mantienen en niveles elevados de deuda desde hace varios años. Esto se debería complementar con el seguimiento de aquellos gobiernos subnacionales que podrían entrar en esta situación a corto o mediano plazo, con un análisis más prospectivo y no sólo retrospectivo sobre posibles riesgos fiscales.', 'labels': ['Incumplimiento severo de metas fiscales', 'Riesgo de sostenibilidad de la deuda', 'Riesgo fiscal potencial', 'Gestión fiscal dentro del marco previsto', 'Inestabilidad institucional moderada', 'Alta incertidumbre macrofiscal', 'Cumplimiento de metas fiscales', 'Transparencia fiscal efectiva', 'Mejora en calidad del gasto público', 'Desviación leve del déficit fiscal', 'Consolidación fiscal sostenida', 'Sostenibilidad fiscal sin observaciones'], 'scores': [0.9183200001716614, 0.8895043730735779, 0.8456342816352844, 0.8026742339134216, 0.5420463681221008, 0.510003387928009, 0.4227660298347473, 0.34065869450569153, 0.30418631434440613, 0.2760094106197357, 0.18603231012821198, 0.11280596256256104]}"
Comunicado042024-VF.pdf,2024.0,9 de octubre de 2024,,1,1,"El Consejo Fiscal (CF), cumpliendo su objeto de contribuir con la gestión transparente y responsable de la política fiscal, expresa su profunda preocupación por la gestión de la política fiscal, que está conduciendo a un marcado deterioro de las fortalezas fiscales del país en los últimos años. La reciente gestión de la política fiscal ha provocado un incremento descontrolado del déficit fiscal, impulsado por la disminución de los ingresos fiscales y el incremento del gasto público, erosionando la credibilidad sobre los principales compromisos de política fiscal y llevando a incumplimientos, que podrían tornarse reiterados, de las reglas fiscales que tanto bien han hecho al país.","{'sequence': 'El Consejo Fiscal (CF), cumpliendo su objeto de contribuir con la gestión transparente y responsable de la política fiscal, expresa su profunda preocupación por la gestión de la política fiscal, que está conduciendo a un marcado deterioro de las fortalezas fiscales del país en los últimos años. La reciente gestión de la política fiscal ha provocado un incremento descontrolado del déficit fiscal, impulsado por la disminución de los ingresos fiscales y el incremento del gasto público, erosionando la credibilidad sobre los principales compromisos de política fiscal y llevando a incumplimientos, que podrían tornarse reiterados, de las reglas fiscales que tanto bien han hecho al país.', 'labels': ['Mejora en calidad del gasto público', 'Incumplimiento severo de metas fiscales', 'Gestión fiscal dentro del marco previsto', 'Cumplimiento de metas fiscales', 'Transparencia fiscal efectiva', 'Desviación leve del déficit fiscal', 'Riesgo fiscal potencial', 'Alta incertidumbre macrofiscal', 'Inestabilidad institucional moderada', 'Consolidación fiscal sostenida', 'Riesgo de sostenibilidad de la deuda', 'Sostenibilidad fiscal sin observaciones'], 'scores': [0.9572451710700989, 0.9488757848739624, 0.9102155566215515, 0.8603717684745789, 0.8603496551513672, 0.8336551189422607, 0.8208495378494263, 0.6683650612831116, 0.5870094895362854, 0.5489238500595093, 0.5447672009468079, 0.2114442139863968]}"
Comunicado042024-VF.pdf,2024.0,9 de octubre de 2024,,1,2,"La actual gestión fiscal está exponiendo al país a múltiples riesgos fiscales, sobre los cuales el CF ya ha emitido alertas, de no ser atendidos, podrían devenir en nuevos incumplimientos de las reglas fiscales o comprometer la sostenibilidad fiscal a mediano y largo plazo. Estos riesgos incluyen la aprobación de la reforma del sistema previsional sin un estudio técnico adecuado sobre su costo actuarial, el continuo apoyo financiero a Petroperú con recursos del Tesoro Público sin una estrategia concreta para su sostenibilidad financiera, el creciente endeudamiento de la Municipalidad Metropolitana de Lima (MML) que podría constreñir su capacidad de prestación de bienes y servicios futuros, y una serie de decisiones en la gestión presupuestal de parte del Ejecutivo que rompen con buenas prácticas de prudencia y responsabilidad que han caracterizado a la gestión fiscal del país.","{'sequence': 'La actual gestión fiscal está exponiendo al país a múltiples riesgos fiscales, sobre los cuales el CF ya ha emitido alertas, de no ser atendidos, podrían devenir en nuevos incumplimientos de las reglas fiscales o comprometer la sostenibilidad fiscal a mediano y largo plazo. Estos riesgos incluyen la aprobación de la reforma del sistema previsional sin un estudio técnico adecuado sobre su costo actuarial, el continuo apoyo financiero a Petroperú con recursos del Tesoro Público sin una estrategia concreta para su sostenibilidad financiera, el creciente endeudamiento de la Municipalidad Metropolitana de Lima (MML) que podría constreñir su capacidad de prestación de bienes y servicios futuros, y una serie de decisiones en la gestión presupuestal de parte del Ejecutivo que rompen con buenas prácticas de prudencia y responsabilidad que han caracterizado a la gestión fiscal del país.', 'labels': ['Riesgo fiscal potencial', 'Incumplimiento severo de metas fiscales', 'Cumplimiento de metas fiscales', 'Gestión fiscal dentro del marco previsto', 'Alta incertidumbre macrofiscal', 'Mejora en calidad del gasto público', 'Riesgo de sostenibilidad de la deuda', 'Consolidación fiscal sostenida', 'Inestabilidad institucional moderada', 'Desviación leve del déficit fiscal', 'Sostenibilidad fiscal sin observaciones', 'Transparencia fiscal efectiva'], 'scores': [0.8488378524780273, 0.816947877407074, 0.7734518051147461, 0.6749630570411682, 0.6661494970321655, 0.5545775890350342, 0.5033015608787537, 0.4032236933708191, 0.331686407327652, 0.23893433809280396, 0.22834637761116028, 0.2080104500055313]}"
Comunicado042024-VF.pdf,2024.0,9 de octubre de 2024,,1,3,"Con relación al déficit fiscal, es preciso señalar que durante 2023 y lo que va de 2024, este ha crecido de manera preocupante. Así, al cierre de agosto, el déficit del Sector Público No Financiero (acumulado en los últimos 12 meses) se mantuvo por cuarto mes consecutivo en 4,0 por ciento del PBI, superando en 1,2 puntos porcentuales (puntos porcentuales) al límite recientemente modificado al alza para este año (2,8 por ciento del PBI). Esta tendencia apunta a un incumplimiento de la regla del déficit fiscal por segundo año consecutivo, a pesar de que los documentos oficiales de política económica indican que la consolidación fiscal debería estar en marcha. De no corregirse esta situación, este sería el cuarto incumplimiento de las reglas fiscales desde su implementación en el año 2000, con el agravante de ser el segundo año consecutivo en que esto ocurre y el primero en que se incumpliría en el mismo año en que se flexibilizó la regla. La reiteración del incumplimiento debilita seriamente la credibilidad fiscal del país, con posibles consecuencias en su calificación crediticia en el corto y mediano plazo y, con ello, un aumento en los costos de financiamiento para el sector público y privado.","{'sequence': 'Con relación al déficit fiscal, es preciso señalar que durante 2023 y lo que va de 2024, este ha crecido de manera preocupante. Así, al cierre de agosto, el déficit del Sector Público No Financiero (acumulado en los últimos 12 meses) se mantuvo por cuarto mes consecutivo en 4,0 por ciento del PBI, superando en 1,2 puntos porcentuales (puntos porcentuales) al límite recientemente modificado al alza para este año (2,8 por ciento del PBI). Esta tendencia apunta a un incumplimiento de la regla del déficit fiscal por segundo año consecutivo, a pesar de que los documentos oficiales de política económica indican que la consolidación fiscal debería estar en marcha. De no corregirse esta situación, este sería el cuarto incumplimiento de las reglas fiscales desde su implementación en el año 2000, con el agravante de ser el segundo año consecutivo en que esto ocurre y el primero en que se incumpliría en el mismo año en que se flexibilizó la regla. La reiteración del incumplimiento debilita seriamente la credibilidad fiscal del país, con posibles consecuencias en su calificación crediticia en el corto y mediano plazo y, con ello, un aumento en los costos de financiamiento para el sector público y privado.', 'labels': ['Gestión fiscal dentro del marco previsto', 'Incumplimiento severo de metas fiscales', 'Riesgo fiscal potencial', 'Alta incertidumbre macrofiscal', 'Desviación leve del déficit fiscal', 'Cumplimiento de metas fiscales', 'Transparencia fiscal efectiva', 'Riesgo de sostenibilidad de la deuda', 'Mejora en calidad del gasto público', 'Inestabilidad institucional moderada', 'Sostenibilidad fiscal sin observaciones', 'Consolidación fiscal sostenida'], 'scores': [0.8870298266410828, 0.8083652257919312, 0.7788439989089966, 0.6357192397117615, 0.6053152084350586, 0.420979380607605, 0.3672848641872406, 0.35600143671035767, 0.33331072330474854, 0.3239797055721283, 0.14655199646949768, 0.05568297952413559]}"
Comunicado042024-VF.pdf,2024.0,9 de octubre de 2024,,2,4,"En este contexto, el CF subraya la urgencia de adoptar medidas que reduzcan el déficit fiscal, vía moderación en el incremento del gasto público o el incremento de los ingresos permanentes.","{'sequence': 'En este contexto, el CF subraya la urgencia de adoptar medidas que reduzcan el déficit fiscal, vía moderación en el incremento del gasto público o el incremento de los ingresos permanentes.', 'labels': ['Mejora en calidad del gasto público', 'Desviación leve del déficit fiscal', 'Cumplimiento de metas fiscales', 'Gestión fiscal dentro del marco previsto', 'Riesgo fiscal potencial', 'Inestabilidad institucional moderada', 'Transparencia fiscal efectiva', 'Consolidación fiscal sostenida', 'Alta incertidumbre macrofiscal', 'Incumplimiento severo de metas fiscales', 'Riesgo de sostenibilidad de la deuda', 'Sostenibilidad fiscal sin observaciones'], 'scores': [0.8599283695220947, 0.8318322896957397, 0.8286311030387878, 0.7110887765884399, 0.43960705399513245, 0.3939337134361267, 0.3800736963748932, 0.2758159041404724, 0.20540791749954224, 0.20178434252738953, 0.10586251318454742, 0.0058808294124901295]}"
Comunicado042024-VF.pdf,2024.0,9 de octubre de 2024,,3,10,"Más allá de las medidas en sí mismas, el CF considera que el principal riesgo fiscal derivado de Petroperú radica en su alto grado de apalancamiento y en que su operatividad implique una situación permanentemente deficitaria. En los últimos años, Petroperú ha registrado niveles de déficit primario y de pagos de intereses significativamente superiores al resto de empresas públicas no financieras, y a junio explicaba entre 0,3 y 0,4 puntos porcentuales del déficit fiscal acumulado (4,0 por ciento del PBI). Si bien la entrada en funcionamiento de la modernizada refinería de Talara debería impactar positivamente en los resultados financieros de la empresa, ello no asegura que el margen sea suficiente para garantizar su sostenibilidad financiera dadas sus notorias ineficiencias y elevados gastos, la fuerte pérdida de participación de mercado en años recientes y el elevado endeudamiento ya contraído. Ante ello, el CF reitera la importancia de que se tomen medidas correctivas para lograr que la gestión de Petroperú se rija bajo criterios de transparencia y buen gobierno corporativo, en línea con las mejores prácticas internacionales.","{'sequence': 'Más allá de las medidas en sí mismas, el CF considera que el principal riesgo fiscal derivado de Petroperú radica en su alto grado de apalancamiento y en que su operatividad implique una situación permanentemente deficitaria. En los últimos años, Petroperú ha registrado niveles de déficit primario y de pagos de intereses significativamente superiores al resto de empresas públicas no financieras, y a junio explicaba entre 0,3 y 0,4 puntos porcentuales del déficit fiscal acumulado (4,0 por ciento del PBI). Si bien la entrada en funcionamiento de la modernizada refinería de Talara debería impactar positivamente en los resultados financieros de la empresa, ello no asegura que el margen sea suficiente para garantizar su sostenibilidad financiera dadas sus notorias ineficiencias y elevados gastos, la fuerte pérdida de participación de mercado en años recientes y el elevado endeudamiento ya contraído. Ante ello, el CF reitera la importancia de que se tomen medidas correctivas para lograr que la gestión de Petroperú se rija bajo criterios de transparencia y buen gobierno corporativo, en línea con las mejores prácticas internacionales.', 'labels': ['Gestión fiscal dentro del marco previsto', 'Transparencia fiscal efectiva', 'Riesgo fiscal potencial', 'Mejora en calidad del gasto público', 'Incumplimiento severo de metas fiscales', 'Cumplimiento de metas fiscales', 'Alta incertidumbre macrofiscal', 'Consolidación fiscal sostenida', 'Inestabilidad institucional moderada', 'Desviación leve del déficit fiscal', 'Riesgo de sostenibilidad de la deuda', 'Sostenibilidad fiscal sin observaciones'], 'scores': [0.8616060614585876, 0.8247782588005066, 0.7826827168464661, 0.7706407904624939, 0.7528780698776245, 0.7514546513557434, 0.7292808890342712, 0.6405048370361328, 0.6115913987159729, 0.5393000841140747, 0.3902093470096588, 0.22015556693077087]}"
Comunicado042024-VF.pdf,2024.0,9 de octubre de 2024,,3,11,"Con relación a la Municipalidad Metropolitana de Lima (MML), el CF nuevamente expresa su preocupación ante el incremento de sus niveles de endeudamiento como consecuencia de la segunda operación de emisión de bonos que ascendió a S/ 1 250 millones. Con esta nueva operación de endeudamiento, el ratio del saldo de deuda total a ingresos de la MML se ubicaría en aproximadamente 300 por ciento, triplicando el límite máximo de la regla fiscal regular para los gobiernos subnacionales (100 por ciento,). En ese sentido, el CF se reafirma en señalar que la actual gestión de la MML está sobreendeudando a la entidad. Ante ello, preocupa que: (i) se haya comprometido, exclusivamente para el pago del servicio de la deuda, y por un periodo de 20 años, sus ingresos por alcabala e impuesto al patrimonio vehicular, que representan aproximadamente el 35 por ciento del total de ingresos; (ii) la imposibilidad de que la MML haga frente a sus obligaciones financieras (servicio de la deuda) y a la vez sostener niveles “normales” de gasto no financiero, principalmente gasto de capital, y (iii) el sobrecosto financiero de aproximadamente S/ 42 millones por año en promedio durante el periodo de repago de la deuda, derivado de la emisión directa de los bonos por parte de la MML y sin garantía del Gobierno Nacional.","{'sequence': 'Con relación a la Municipalidad Metropolitana de Lima (MML), el CF nuevamente expresa su preocupación ante el incremento de sus niveles de endeudamiento como consecuencia de la segunda operación de emisión de bonos que ascendió a S/ 1 250 millones. Con esta nueva operación de endeudamiento, el ratio del saldo de deuda total a ingresos de la MML se ubicaría en aproximadamente 300 por ciento, triplicando el límite máximo de la regla fiscal regular para los gobiernos subnacionales (100 por ciento,). En ese sentido, el CF se reafirma en señalar que la actual gestión de la MML está sobreendeudando a la entidad. Ante ello, preocupa que: (i) se haya comprometido, exclusivamente para el pago del servicio de la deuda, y por un periodo de 20 años, sus ingresos por alcabala e impuesto al patrimonio vehicular, que representan aproximadamente el 35 por ciento del total de ingresos; (ii) la imposibilidad de que la MML haga frente a sus obligaciones financieras (servicio de la deuda) y a la vez sostener niveles “normales” de gasto no financiero, principalmente gasto de capital, y (iii) el sobrecosto financiero de aproximadamente S/ 42 millones por año en promedio durante el periodo de repago de la deuda, derivado de la emisión directa de los bonos por parte de la MML y sin garantía del Gobierno Nacional.', 'labels': ['Riesgo de sostenibilidad de la deuda', 'Riesgo fiscal potencial', 'Gestión fiscal dentro del marco previsto', 'Inestabilidad institucional moderada', 'Incumplimiento severo de metas fiscales', 'Alta incertidumbre macrofiscal', 'Mejora en calidad del gasto público', 'Cumplimiento de metas fiscales', 'Transparencia fiscal efectiva', 'Desviación leve del déficit fiscal', 'Sostenibilidad fiscal sin observaciones', 'Consolidación fiscal sostenida'], 'scores': [0.9719606041908264, 0.8122549653053284, 0.7466706037521362, 0.5631536841392517, 0.5291588306427002, 0.493436723947525, 0.43859153985977173, 0.4120233952999115, 0.38450613617897034, 0.32536575198173523, 0.31653228402137756, 0.19542792439460754]}"
Comunicado042024-VF.pdf,2024.0,9 de octubre de 2024,,4,13,"establecer excepciones al cumplimiento de las reglas fiscales basadas en calificaciones crediticias. El análisis de las calificadoras de riesgo con respecto a los instrumentos de deuda emitidos se enfoca principalmente en la probabilidad de que la entidad evaluada cumpla con el repago de su deuda financiera o cuente con los mecanismos que garanticen su recuperación, lo cual, en este caso, es altamente probable al haber cedido la MML sus ingresos de alcabala e impuestos al patrimonio vehicular al fideicomiso de pago de la deuda. Además, las calificaciones crediticias de los gobiernos subnacionales usualmente consideran un aval implícito por parte del Gobierno Nacional, lo cual favorece la calificación de la entidad evaluada. De otro lado, el objetivo del hacedor de política fiscal y de las reglas fiscales es garantizar la sostenibilidad fiscal de la entidad, lo que implica honrar sus compromisos financieros y a la vez asegurar la provisión adecuada de servicios a la población con el financiamiento de sus gastos corrientes y de capital.","{'sequence': 'establecer excepciones al cumplimiento de las reglas fiscales basadas en calificaciones crediticias. El análisis de las calificadoras de riesgo con respecto a los instrumentos de deuda emitidos se enfoca principalmente en la probabilidad de que la entidad evaluada cumpla con el repago de su deuda financiera o cuente con los mecanismos que garanticen su recuperación, lo cual, en este caso, es altamente probable al haber cedido la MML sus ingresos de alcabala e impuestos al patrimonio vehicular al fideicomiso de pago de la deuda. Además, las calificaciones crediticias de los gobiernos subnacionales usualmente consideran un aval implícito por parte del Gobierno Nacional, lo cual favorece la calificación de la entidad evaluada. De otro lado, el objetivo del hacedor de política fiscal y de las reglas fiscales es garantizar la sostenibilidad fiscal de la entidad, lo que implica honrar sus compromisos financieros y a la vez asegurar la provisión adecuada de servicios a la población con el financiamiento de sus gastos corrientes y de capital.', 'labels': ['Consolidación fiscal sostenida', 'Riesgo de sostenibilidad de la deuda', 'Cumplimiento de metas fiscales', 'Gestión fiscal dentro del marco previsto', 'Riesgo fiscal potencial', 'Transparencia fiscal efectiva', 'Mejora en calidad del gasto público', 'Alta incertidumbre macrofiscal', 'Inestabilidad institucional moderada', 'Desviación leve del déficit fiscal', 'Incumplimiento severo de metas fiscales', 'Sostenibilidad fiscal sin observaciones'], 'scores': [0.9292806386947632, 0.8758373856544495, 0.8707378506660461, 0.8354109525680542, 0.7128495573997498, 0.5254100561141968, 0.5086401104927063, 0.39543548226356506, 0.3572612702846527, 0.3482668995857239, 0.09467923641204834, 0.04927770793437958]}"
Comunicado042024-VF.pdf,2024.0,9 de octubre de 2024,,4,14,"Finalmente, el CF subraya que los riesgos mencionados en este comunicado se están materializando ante la actitud pasiva del Poder Ejecutivo, que no ha tomado medidas efectivas para mitigarlos. En opinión del CF, esto revela una creciente fragilidad institucional y debilidad del gobierno frente a otros actores políticos. En el mismo sentido, revela un menor margen de maniobra del Ministerio de Economía y Finanzas (MEF) al interior del Ejecutivo, a la luz de la incapacidad de oponerse a iniciativas legislativas que generan mayores gastos públicos y afectan la sostenibilidad fiscal, a las demandas por parte de los gobiernos subnacionales, y también de cara a las decisiones que se toman en el seno del propio Poder Ejecutivo.","{'sequence': 'Finalmente, el CF subraya que los riesgos mencionados en este comunicado se están materializando ante la actitud pasiva del Poder Ejecutivo, que no ha tomado medidas efectivas para mitigarlos. En opinión del CF, esto revela una creciente fragilidad institucional y debilidad del gobierno frente a otros actores políticos. En el mismo sentido, revela un menor margen de maniobra del Ministerio de Economía y Finanzas (MEF) al interior del Ejecutivo, a la luz de la incapacidad de oponerse a iniciativas legislativas que generan mayores gastos públicos y afectan la sostenibilidad fiscal, a las demandas por parte de los gobiernos subnacionales, y también de cara a las decisiones que se toman en el seno del propio Poder Ejecutivo.', 'labels': ['Riesgo fiscal potencial', 'Mejora en calidad del gasto público', 'Gestión fiscal dentro del marco previsto', 'Alta incertidumbre macrofiscal', 'Riesgo de sostenibilidad de la deuda', 'Incumplimiento severo de metas fiscales', 'Consolidación fiscal sostenida', 'Cumplimiento de metas fiscales', 'Desviación leve del déficit fiscal', 'Inestabilidad institucional moderada', 'Transparencia fiscal efectiva', 'Sostenibilidad fiscal sin observaciones'], 'scores': [0.887963593006134, 0.8816346526145935, 0.7245577573776245, 0.7155051231384277, 0.6555567383766174, 0.6489270925521851, 0.622773289680481, 0.5531661510467529, 0.4610438942909241, 0.20689785480499268, 0.17278341948986053, 0.15049386024475098]}"
Pronunciamiento-IAPM25-28-VF.pdf,2025.0,15 de mayo de 2025,,1,5,"El CF considera muy poco probable el cumplimiento de las reglas fiscales a partir de 2026 en ausencia de medidas de consolidación fiscal significativas. Por ello, exhorta a adoptar, en el corto plazo, medidas concretas para cumplir con la senda fiscal vigente. No retornar a una senda fiscal equilibrada podría llevar a un deterioro de la calificación crediticia del país, lo que afectaría tanto el costo de financiamiento del sector público como del sector privado, y podría influir negativamente en los flujos de inversión.","{'sequence': 'El CF considera muy poco probable el cumplimiento de las reglas fiscales a partir de 2026 en ausencia de medidas de consolidación fiscal significativas. Por ello, exhorta a adoptar, en el corto plazo, medidas concretas para cumplir con la senda fiscal vigente. No retornar a una senda fiscal equilibrada podría llevar a un deterioro de la calificación crediticia del país, lo que afectaría tanto el costo de financiamiento del sector público como del sector privado, y podría influir negativamente en los flujos de inversión.', 'labels': ['Incumplimiento severo de metas fiscales', 'Mejora en calidad del gasto público', 'Gestión fiscal dentro del marco previsto', 'Riesgo fiscal potencial', 'Cumplimiento de metas fiscales', 'Alta incertidumbre macrofiscal', 'Sostenibilidad fiscal sin observaciones', 'Riesgo de sostenibilidad de la deuda', 'Consolidación fiscal sostenida', 'Inestabilidad institucional moderada', 'Transparencia fiscal efectiva', 'Desviación leve del déficit fiscal'], 'scores': [0.960216224193573, 0.9081143736839294, 0.8876179456710815, 0.8676468729972839, 0.8653821349143982, 0.7199420928955078, 0.7019951343536377, 0.6894027590751648, 0.6892377138137817, 0.6244815587997437, 0.5153726935386658, 0.43374720215797424]}"
