filename,year,date,announcement,page,paragraph_id,text,sentiment
CF-Informe-MMM2124-cNotaAclaratoria-28-de-agosto-VF-publicada.pdf,2020.0,14 de agosto de 2020,,13,73,"A fin de garantizar el equilibrio presupuestal de los años 2020 y 2021, el CF sugiere que el MEF presente un informe evaluando los impactos que esta última propuesta tendría sobre las cuentas fiscales. Asimismo, el análisis de riesgos presentado en el MMM debería incluir una evaluación de las contingencias de mediano plazo derivadas del sistema previsional y su impacto sobre la sostenibilidad de la deuda pública. Del mismo modo, el CF recalca, que para garantizar la sostenibilidad de las finanzas públicas se requiere que las presiones de gasto permanente sean acompañadas de un incremento proporcional de ingresos permanentes. En este contexto en que las finanzas públicas se han debilitado, el Perú requiere reafirmar la naturaleza temporal de las medidas fiscales para contrarrestar los efectos de la pandemia y no promover iniciativas que socavan aún más la sostenibilidad fiscal.","{'sequence': 'A fin de garantizar el equilibrio presupuestal de los años 2020 y 2021, el CF sugiere que el MEF presente un informe evaluando los impactos que esta última propuesta tendría sobre las cuentas fiscales. Asimismo, el análisis de riesgos presentado en el MMM debería incluir una evaluación de las contingencias de mediano plazo derivadas del sistema previsional y su impacto sobre la sostenibilidad de la deuda pública. Del mismo modo, el CF recalca, que para garantizar la sostenibilidad de las finanzas públicas se requiere que las presiones de gasto permanente sean acompañadas de un incremento proporcional de ingresos permanentes. En este contexto en que las finanzas públicas se han debilitado, el Perú requiere reafirmar la naturaleza temporal de las medidas fiscales para contrarrestar los efectos de la pandemia y no promover iniciativas que socavan aún más la sostenibilidad fiscal.', 'labels': ['Riesgo de sostenibilidad de la deuda', 'Riesgo fiscal potencial', 'Gestión fiscal dentro del marco previsto', 'Cumplimiento de metas fiscales', 'Consolidación fiscal sostenida', 'Transparencia fiscal efectiva', 'Incumplimiento de metas fiscales', 'Desviación del déficit fiscal'], 'scores': [0.9357566833496094, 0.6902215480804443, 0.6850225329399109, 0.6491689085960388, 0.40412071347236633, 0.32745465636253357, 0.19637949764728546, 0.16744178533554077]}"
CF-Informe-MMM2124-cNotaAclaratoria-28-de-agosto-VF-publicada.pdf,2020.0,14 de agosto de 2020,,13,74,"Por otro lado, para el periodo 2022-2024, el CF nota que el GNF promedio previsto, de 21,1 por ciento del PBI, es el más alto en más de 40 años, lo cual no es consistente con la necesidad de reconstruir las cuentas fiscales del país, retomar la senda de sostenibilidad de la deuda pública e iniciar un proceso de consolidación fiscal. El alto nivel de GNF que se proyecta en el MMM podría estar brindando al siguiente gobierno la percepción de un espacio fiscal para políticas expansivas que, a raíz de la crisis del COVID-19, ya no serían posibles en los próximos años.","{'sequence': 'Por otro lado, para el periodo 2022-2024, el CF nota que el GNF promedio previsto, de 21,1 por ciento del PBI, es el más alto en más de 40 años, lo cual no es consistente con la necesidad de reconstruir las cuentas fiscales del país, retomar la senda de sostenibilidad de la deuda pública e iniciar un proceso de consolidación fiscal. El alto nivel de GNF que se proyecta en el MMM podría estar brindando al siguiente gobierno la percepción de un espacio fiscal para políticas expansivas que, a raíz de la crisis del COVID-19, ya no serían posibles en los próximos años.', 'labels': ['Gestión fiscal dentro del marco previsto', 'Riesgo de sostenibilidad de la deuda', 'Cumplimiento de metas fiscales', 'Incumplimiento de metas fiscales', 'Consolidación fiscal sostenida', 'Riesgo fiscal potencial', 'Desviación del déficit fiscal', 'Transparencia fiscal efectiva'], 'scores': [0.9409944415092468, 0.8961583971977234, 0.8484578132629395, 0.7250998020172119, 0.5191320776939392, 0.5058720111846924, 0.3446657955646515, 0.28386080265045166]}"
CF-Informe-MMM2124-cNotaAclaratoria-28-de-agosto-VF-publicada.pdf,2020.0,14 de agosto de 2020,,13,75,"En este sentido, el CF recomienda que las previsiones de gasto público de mediano y largo plazo consideren la necesidad de llevar adelante un proceso de consolidación fiscal que asegure el retorno de la deuda pública hacia una senda de sostenibilidad. El reto de la consolidación fiscal requerirá que se utilicen todas las herramientas posibles, en búsqueda del logro de los objetivos fiscales, pero minimizando los efectos adversos sobre la actividad económica. Por el lado del gasto será necesario generar ahorros fiscales mediante acciones que incidan en la calidad del","{'sequence': 'En este sentido, el CF recomienda que las previsiones de gasto público de mediano y largo plazo consideren la necesidad de llevar adelante un proceso de consolidación fiscal que asegure el retorno de la deuda pública hacia una senda de sostenibilidad. El reto de la consolidación fiscal requerirá que se utilicen todas las herramientas posibles, en búsqueda del logro de los objetivos fiscales, pero minimizando los efectos adversos sobre la actividad económica. Por el lado del gasto será necesario generar ahorros fiscales mediante acciones que incidan en la calidad del', 'labels': ['Gestión fiscal dentro del marco previsto', 'Consolidación fiscal sostenida', 'Riesgo de sostenibilidad de la deuda', 'Cumplimiento de metas fiscales', 'Riesgo fiscal potencial', 'Transparencia fiscal efectiva', 'Incumplimiento de metas fiscales', 'Desviación del déficit fiscal'], 'scores': [0.9639072418212891, 0.9486274123191833, 0.6125245094299316, 0.5772618651390076, 0.3297160863876343, 0.3028390407562256, 0.2970903813838959, 0.2408563196659088]}"
CF-Informe-MMM2124-cNotaAclaratoria-28-de-agosto-VF-publicada.pdf,2020.0,14 de agosto de 2020,,14,80,"Como se mencionó en el informe N003-2020-CF, el CF advierte que los pasivos contingentes generados por el programa Reactiva Perú suponen una presión adicional al incremento de la deuda. De considerar la materialización esperada de las garantías, por 15 mil millones de soles entre 2021 y 2023, prevista en el diseño del programa, la deuda estaría 1,8 puntos porcentuales del PBI por encima de lo esperado en el MMM a partir del 2023. El CF opina que el diseño de la consolidación fiscal debería considerar este efecto, toda vez que la probabilidad de ocurrencia de estos contingentes es elevada, aun cuando la magnitud de la materialización es incierta.","{'sequence': 'Como se mencionó en el informe N003-2020-CF, el CF advierte que los pasivos contingentes generados por el programa Reactiva Perú suponen una presión adicional al incremento de la deuda. De considerar la materialización esperada de las garantías, por 15 mil millones de soles entre 2021 y 2023, prevista en el diseño del programa, la deuda estaría 1,8 puntos porcentuales del PBI por encima de lo esperado en el MMM a partir del 2023. El CF opina que el diseño de la consolidación fiscal debería considerar este efecto, toda vez que la probabilidad de ocurrencia de estos contingentes es elevada, aun cuando la magnitud de la materialización es incierta.', 'labels': ['Gestión fiscal dentro del marco previsto', 'Riesgo de sostenibilidad de la deuda', 'Riesgo fiscal potencial', 'Incumplimiento de metas fiscales', 'Cumplimiento de metas fiscales', 'Consolidación fiscal sostenida', 'Transparencia fiscal efectiva', 'Desviación del déficit fiscal'], 'scores': [0.8934954404830933, 0.873950183391571, 0.6011586785316467, 0.541711151599884, 0.5401930212974548, 0.5217505097389221, 0.46114322543144226, 0.30660441517829895]}"
CF-Informe-MMM2124-cNotaAclaratoria-28-de-agosto-VF-publicada.pdf,2020.0,14 de agosto de 2020,,15,82,"Consolidación fiscal y sostenibilidad de la deuda pública Como se mencionó en el Informe N004-2020-CF, es importante que el MEF vuelva a calibrar la trayectoria de convergencia de la deuda pública, a la luz de la nueva situación macroeconómica.","{'sequence': 'Consolidación fiscal y sostenibilidad de la deuda pública Como se mencionó en el Informe N004-2020-CF, es importante que el MEF vuelva a calibrar la trayectoria de convergencia de la deuda pública, a la luz de la nueva situación macroeconómica.', 'labels': ['Consolidación fiscal sostenida', 'Cumplimiento de metas fiscales', 'Gestión fiscal dentro del marco previsto', 'Transparencia fiscal efectiva', 'Desviación del déficit fiscal', 'Riesgo fiscal potencial', 'Incumplimiento de metas fiscales', 'Riesgo de sostenibilidad de la deuda'], 'scores': [0.9515570402145386, 0.7045185565948486, 0.6823828816413879, 0.24863852560520172, 0.13424046337604523, 0.13259565830230713, 0.12385973334312439, 0.029491644352674484]}"
CF-Informe-MMM2124-cNotaAclaratoria-28-de-agosto-VF-publicada.pdf,2020.0,14 de agosto de 2020,,15,86,"Como se mencionó en los informes N004-2020-CF y N005-2020-CF, asegurar la consolidación fiscal futura es necesario para salvaguardar la sostenibilidad de las finanzas públicas, disminuyendo el nivel de endeudamiento y recomponiendo los activos financieros que permitan en el futuro afrontar crisis como la actual. Para ello, el CF recomienda utilizar supuestos neutrales para la proyección de las cuentas fiscales y advierte que los supuestos macroeconómicos de mediano plazo utilizados en el MMM podrían estar subestimando el resultado primario requerido para estabilizar la deuda pública y, con ello, distorsionando la trayectoria de mediano plazo del ratio de deuda. Como se señaló en el informe N 003-2020, cuando la tasa de crecimiento económico es inferior al costo de endeudamiento público, se requiere un mayor esfuerzo fiscal para controlar la dinámica de la deuda pública. Por último, en senda de consolidación fiscal a mediano plazo.","{'sequence': 'Como se mencionó en los informes N004-2020-CF y N005-2020-CF, asegurar la consolidación fiscal futura es necesario para salvaguardar la sostenibilidad de las finanzas públicas, disminuyendo el nivel de endeudamiento y recomponiendo los activos financieros que permitan en el futuro afrontar crisis como la actual. Para ello, el CF recomienda utilizar supuestos neutrales para la proyección de las cuentas fiscales y advierte que los supuestos macroeconómicos de mediano plazo utilizados en el MMM podrían estar subestimando el resultado primario requerido para estabilizar la deuda pública y, con ello, distorsionando la trayectoria de mediano plazo del ratio de deuda. Como se señaló en el informe N 003-2020, cuando la tasa de crecimiento económico es inferior al costo de endeudamiento público, se requiere un mayor esfuerzo fiscal para controlar la dinámica de la deuda pública. Por último, en senda de consolidación fiscal a mediano plazo.', 'labels': ['Consolidación fiscal sostenida', 'Gestión fiscal dentro del marco previsto', 'Cumplimiento de metas fiscales', 'Riesgo de sostenibilidad de la deuda', 'Transparencia fiscal efectiva', 'Desviación del déficit fiscal', 'Riesgo fiscal potencial', 'Incumplimiento de metas fiscales'], 'scores': [0.9212450981140137, 0.8298771977424622, 0.8245804309844971, 0.7751736640930176, 0.6554592847824097, 0.5904229283332825, 0.5460434556007385, 0.4920177459716797]}"
CF-Informe-MMM2124-cNotaAclaratoria-28-de-agosto-VF-publicada.pdf,2020.0,14 de agosto de 2020,,16,91,"En este contexto, el CF considera que las iniciativas legislativas con potencial para elevar el gasto público permanente o temporal constituyen una fuente de riesgos fiscales que agravaría la crisis fiscal producida por el COVID-19 y haría mucho más difícil alcanzar la sostenibilidad fiscal de mediano plazo. En ese escenario, el CF llama a actuar con responsabilidad fiscal, tanto al Poder Ejecutivo como al Legislativo, y evitar iniciativas que generen incrementos de gasto público o que erosionen la capacidad de generación de ingresos públicos. En el caso de las propuestas del Poder Legislativo que pueden significar una iniciativa de gasto, sería apropiado que el Poder Ejecutivo apele a la instancia que garantiza el cumplimiento de la Constitución Política, el Tribunal Constitucional.","{'sequence': 'En este contexto, el CF considera que las iniciativas legislativas con potencial para elevar el gasto público permanente o temporal constituyen una fuente de riesgos fiscales que agravaría la crisis fiscal producida por el COVID-19 y haría mucho más difícil alcanzar la sostenibilidad fiscal de mediano plazo. En ese escenario, el CF llama a actuar con responsabilidad fiscal, tanto al Poder Ejecutivo como al Legislativo, y evitar iniciativas que generen incrementos de gasto público o que erosionen la capacidad de generación de ingresos públicos. En el caso de las propuestas del Poder Legislativo que pueden significar una iniciativa de gasto, sería apropiado que el Poder Ejecutivo apele a la instancia que garantiza el cumplimiento de la Constitución Política, el Tribunal Constitucional.', 'labels': ['Riesgo fiscal potencial', 'Gestión fiscal dentro del marco previsto', 'Cumplimiento de metas fiscales', 'Transparencia fiscal efectiva', 'Riesgo de sostenibilidad de la deuda', 'Consolidación fiscal sostenida', 'Incumplimiento de metas fiscales', 'Desviación del déficit fiscal'], 'scores': [0.9612022638320923, 0.8689107894897461, 0.6958150863647461, 0.5892784595489502, 0.5752463340759277, 0.5569872260093689, 0.4950794577598572, 0.3492295444011688]}"
CF-Informe-MMM2124-cNotaAclaratoria-28-de-agosto-VF-publicada.pdf,2020.0,14 de agosto de 2020,,17,94,"promedio móvil para dicho periodo previsto en el MMM, de 21,1 por ciento del del PBI, es el nivel más alto desde fines de los años setenta, lo cual no es consistente con la necesidad de reconstruir las cuentas fiscales del país, retomar la senda de sostenibilidad de la deuda pública e iniciar un proceso de consolidación fiscal. En este contexto, el mayor riesgo fiscal estará determinado por la poca capacidad para generar mayores ingresos permanentes, frente a la rigidez y el nivel de gasto planteado para el mediano plazo. En consecuencia, el CF considera que se debe adoptar una senda de consolidación creíble en el mediano plazo y definir un límite de deuda pública, a la luz de la nueva situación macroeconómica, para establecer dicha convergencia.","{'sequence': 'promedio móvil para dicho periodo previsto en el MMM, de 21,1 por ciento del del PBI, es el nivel más alto desde fines de los años setenta, lo cual no es consistente con la necesidad de reconstruir las cuentas fiscales del país, retomar la senda de sostenibilidad de la deuda pública e iniciar un proceso de consolidación fiscal. En este contexto, el mayor riesgo fiscal estará determinado por la poca capacidad para generar mayores ingresos permanentes, frente a la rigidez y el nivel de gasto planteado para el mediano plazo. En consecuencia, el CF considera que se debe adoptar una senda de consolidación creíble en el mediano plazo y definir un límite de deuda pública, a la luz de la nueva situación macroeconómica, para establecer dicha convergencia.', 'labels': ['Gestión fiscal dentro del marco previsto', 'Riesgo de sostenibilidad de la deuda', 'Incumplimiento de metas fiscales', 'Cumplimiento de metas fiscales', 'Riesgo fiscal potencial', 'Consolidación fiscal sostenida', 'Transparencia fiscal efectiva', 'Desviación del déficit fiscal'], 'scores': [0.9676253795623779, 0.9399499297142029, 0.9085361957550049, 0.9031798839569092, 0.896285355091095, 0.8767131567001343, 0.5500811338424683, 0.5151306390762329]}"
Comunicado-CF-161220.pdf,2020.0,16 de diciembre de 2020,,1,1,"El Consejo Fiscal (CF) expresa su preocupación por la aprobación, por parte del Congreso de la República, de un grupo de iniciativas legislativas referidas a diversos aspectos laborales aplicables a los trabajadores del Sector Público. Tales medidas, además de reducir la calidad del gasto público, generarán un aumento significativo del mismo en los próximos años, lo cual no atiende la necesidad de iniciar un proceso de consolidación fiscal que permita asegurar la sostenibilidad de las finanzas públicas, que se han visto seriamente afectadas por la crisis del COVID-19. Estos proyectos de ley aprobados son: 1. La autógrafa que deroga el Decreto de Urgencia N 014-2020 que regula los procesos de negociaciones colectivas en el Sector Público (aprobada el 25 de noviembre de 2020).","{'sequence': 'El Consejo Fiscal (CF) expresa su preocupación por la aprobación, por parte del Congreso de la República, de un grupo de iniciativas legislativas referidas a diversos aspectos laborales aplicables a los trabajadores del Sector Público. Tales medidas, además de reducir la calidad del gasto público, generarán un aumento significativo del mismo en los próximos años, lo cual no atiende la necesidad de iniciar un proceso de consolidación fiscal que permita asegurar la sostenibilidad de las finanzas públicas, que se han visto seriamente afectadas por la crisis del COVID-19. Estos proyectos de ley aprobados son: 1. La autógrafa que deroga el Decreto de Urgencia N 014-2020 que regula los procesos de negociaciones colectivas en el Sector Público (aprobada el 25 de noviembre de 2020).', 'labels': ['Consolidación fiscal sostenida', 'Gestión fiscal dentro del marco previsto', 'Riesgo fiscal potencial', 'Cumplimiento de metas fiscales', 'Riesgo de sostenibilidad de la deuda', 'Incumplimiento de metas fiscales', 'Transparencia fiscal efectiva', 'Desviación del déficit fiscal'], 'scores': [0.8934612274169922, 0.7560880184173584, 0.5468488335609436, 0.4814150929450989, 0.3203410506248474, 0.2894677221775055, 0.20309777557849884, 0.10653579980134964]}"
Comunicado-CF-161220.pdf,2020.0,16 de diciembre de 2020,,1,4,"La derogación del DU N 014-2020 conllevará que los acuerdos logrados o los laudos arbitrales que se deriven de procesos de negociación colectiva, se expidan sin la observancia obligatoria del informe económico financiero que debe emitir el Ministerio de Economía y Finanzas, el cual busca brindar información a las partes involucradas en la negociación (trabajadores, entidad pública y árbitros) sobre hasta qué punto los petitorios de los servidores públicos son atendibles sin transgredir los principios de responsabilidad fiscal y equilibrio presupuestario. Corresponde indicar que el propio Tribunal Constitucional ha resaltado que la normatividad sobre negociaciones colectivas en el sector público debe asegurar que el ejercicio de dicho derecho no genere “(...) un exceso de gastos que conlleven un desbalance en el presupuesto general de la república”.","{'sequence': 'La derogación del DU N 014-2020 conllevará que los acuerdos logrados o los laudos arbitrales que se deriven de procesos de negociación colectiva, se expidan sin la observancia obligatoria del informe económico financiero que debe emitir el Ministerio de Economía y Finanzas, el cual busca brindar información a las partes involucradas en la negociación (trabajadores, entidad pública y árbitros) sobre hasta qué punto los petitorios de los servidores públicos son atendibles sin transgredir los principios de responsabilidad fiscal y equilibrio presupuestario. Corresponde indicar que el propio Tribunal Constitucional ha resaltado que la normatividad sobre negociaciones colectivas en el sector público debe asegurar que el ejercicio de dicho derecho no genere “(...) un exceso de gastos que conlleven un desbalance en el presupuesto general de la república”.', 'labels': ['Riesgo fiscal potencial', 'Gestión fiscal dentro del marco previsto', 'Cumplimiento de metas fiscales', 'Riesgo de sostenibilidad de la deuda', 'Incumplimiento de metas fiscales', 'Consolidación fiscal sostenida', 'Desviación del déficit fiscal', 'Transparencia fiscal efectiva'], 'scores': [0.8011531829833984, 0.795103132724762, 0.7421680688858032, 0.6135701537132263, 0.6132453680038452, 0.5535933375358582, 0.46126753091812134, 0.4398949146270752]}"
CF-Informe-MMM2124-publicado-enviado-CF-VF.pdf,2020.0,16 de setiembre de 2020,,1,2,"Como se expresó en el Informe N007-2020-CF, el MMM publicado presenta cambios respecto al proyecto de MMM enviado por el Ministerio de Economía y Finanzas (MEF) para que el CF emita su opinión. Algunos cambios recomendados por el CF, como la revisión a la baja de las proyecciones sobre el PBI y el Gasto No Financiero del Gobierno General para el año 2020 han sido incluidos en la versión final. Sin embargo, el MMM publicado no atiende las preocupaciones centrales expresadas por el CF referidas a: i) la restitución de las reglas fiscales a partir del año del proceso de consolidación fiscal requerido en los próximos años. A juicio del CF, la atención a estos temas es necesaria para recuperar la solidez fiscal que ha caracterizado a la economía peruana en los últimos 20 años.","{'sequence': 'Como se expresó en el Informe N007-2020-CF, el MMM publicado presenta cambios respecto al proyecto de MMM enviado por el Ministerio de Economía y Finanzas (MEF) para que el CF emita su opinión. Algunos cambios recomendados por el CF, como la revisión a la baja de las proyecciones sobre el PBI y el Gasto No Financiero del Gobierno General para el año 2020 han sido incluidos en la versión final. Sin embargo, el MMM publicado no atiende las preocupaciones centrales expresadas por el CF referidas a: i) la restitución de las reglas fiscales a partir del año del proceso de consolidación fiscal requerido en los próximos años. A juicio del CF, la atención a estos temas es necesaria para recuperar la solidez fiscal que ha caracterizado a la economía peruana en los últimos 20 años.', 'labels': ['Gestión fiscal dentro del marco previsto', 'Cumplimiento de metas fiscales', 'Incumplimiento de metas fiscales', 'Riesgo fiscal potencial', 'Consolidación fiscal sostenida', 'Riesgo de sostenibilidad de la deuda', 'Transparencia fiscal efectiva', 'Desviación del déficit fiscal'], 'scores': [0.908636212348938, 0.8621420860290527, 0.7958159446716309, 0.7355833053588867, 0.7228896021842957, 0.713252067565918, 0.6064965128898621, 0.512817919254303]}"
CF-Informe-MMM2124-publicado-enviado-CF-VF.pdf,2020.0,16 de setiembre de 2020,,1,4,"Con el objetivo de salvaguardar la sostenibilidad fiscal, el CF considera fundamental la restitución de un sistema de reglas fiscales, que permita establecer límites a las acciones de política fiscal y defina el nivel sostenible de endeudamiento público, que tendría que entrar en vigor antes del inicio del proceso presupuestario del año fiscal 2022.","{'sequence': 'Con el objetivo de salvaguardar la sostenibilidad fiscal, el CF considera fundamental la restitución de un sistema de reglas fiscales, que permita establecer límites a las acciones de política fiscal y defina el nivel sostenible de endeudamiento público, que tendría que entrar en vigor antes del inicio del proceso presupuestario del año fiscal 2022.', 'labels': ['Gestión fiscal dentro del marco previsto', 'Cumplimiento de metas fiscales', 'Consolidación fiscal sostenida', 'Riesgo de sostenibilidad de la deuda', 'Riesgo fiscal potencial', 'Transparencia fiscal efectiva', 'Desviación del déficit fiscal', 'Incumplimiento de metas fiscales'], 'scores': [0.9233217835426331, 0.740727961063385, 0.6688840985298157, 0.6562148332595825, 0.5614988803863525, 0.45522284507751465, 0.3066222071647644, 0.21106195449829102]}"
