filename,year,date,announcement,page,paragraph_id,text,sentiment
Pronunciamiento_Subnacional_2024_240624.pdf,2024.0,5 de julio de 2024,,5,24,"acerca de que el incremento de la deuda de la MML podría generar un posible incumplimiento futuro de obligaciones, afectando la solvencia y capacidad de pago de las futuras gestiones municipales, así como la provisión de servicios públicos. A su vez, el CF expresa su preocupación por la potencial materialización de contingencias, como los resarcimientos económicos por arbitrajes internacionales, que podrían incrementar aún más los niveles de deuda de la MML.","{'sequence': 'acerca de que el incremento de la deuda de la MML podría generar un posible incumplimiento futuro de obligaciones, afectando la solvencia y capacidad de pago de las futuras gestiones municipales, así como la provisión de servicios públicos. A su vez, el CF expresa su preocupación por la potencial materialización de contingencias, como los resarcimientos económicos por arbitrajes internacionales, que podrían incrementar aún más los niveles de deuda de la MML.', 'labels': ['Riesgo de sostenibilidad de la deuda', 'Riesgo fiscal potencial', 'Gestión fiscal dentro del marco previsto', 'Cumplimiento de metas fiscales', 'Incumplimiento de metas fiscales', 'Transparencia fiscal efectiva', 'Consolidación fiscal sostenida', 'Desviación del déficit fiscal'], 'scores': [0.9504832625389099, 0.8663046956062317, 0.8639379739761353, 0.33245107531547546, 0.33183786273002625, 0.24759644269943237, 0.22976741194725037, 0.1462886482477188]}"
Pronunciamiento_Subnacional_2024_240624.pdf,2024.0,5 de julio de 2024,,5,27,"Finalmente, el CF reitera de que no es adecuado establecer excepciones al cumplimiento de las reglas fiscales basadas en calificaciones crediticias, pues estas: i) evalúan solo la posibilidad de default de la deuda financiera comercial de las entidades evaluadas, y (ii) asumen un probable respaldo o garantía implícita del Gobierno Nacional. Además, el CF observa que las calificaciones crediticias presentadas por la MML se han elaborado a partir de información de estados financieros que ha sido observada por la Dirección General de Contabilidad (DGCP) del MEF. Sobre este punto, el CF expresa su preocupación; ya que, dichas calificaciones, aprobadas por el MEF para mantener a la MML en su condición de “Exceptuado”, utilizan información observada por esta propia entidad. Esta inconsistencia refuerza la posición del CF respecto a que no es adecuado utilizar calificaciones crediticias como sustituto de las reglas fiscales subnacionales para exceptuarse de las medidas correctivas del MRTF-SN y los límites de endeudamiento previstos en la legislación nacional.","{'sequence': 'Finalmente, el CF reitera de que no es adecuado establecer excepciones al cumplimiento de las reglas fiscales basadas en calificaciones crediticias, pues estas: i) evalúan solo la posibilidad de default de la deuda financiera comercial de las entidades evaluadas, y (ii) asumen un probable respaldo o garantía implícita del Gobierno Nacional. Además, el CF observa que las calificaciones crediticias presentadas por la MML se han elaborado a partir de información de estados financieros que ha sido observada por la Dirección General de Contabilidad (DGCP) del MEF. Sobre este punto, el CF expresa su preocupación; ya que, dichas calificaciones, aprobadas por el MEF para mantener a la MML en su condición de “Exceptuado”, utilizan información observada por esta propia entidad. Esta inconsistencia refuerza la posición del CF respecto a que no es adecuado utilizar calificaciones crediticias como sustituto de las reglas fiscales subnacionales para exceptuarse de las medidas correctivas del MRTF-SN y los límites de endeudamiento previstos en la legislación nacional.', 'labels': ['Gestión fiscal dentro del marco previsto', 'Riesgo de sostenibilidad de la deuda', 'Cumplimiento de metas fiscales', 'Transparencia fiscal efectiva', 'Riesgo fiscal potencial', 'Consolidación fiscal sostenida', 'Incumplimiento de metas fiscales', 'Desviación del déficit fiscal'], 'scores': [0.8151556253433228, 0.7708774209022522, 0.7506948709487915, 0.6402348279953003, 0.6298779249191284, 0.5907845497131348, 0.5587475895881653, 0.37343716621398926]}"
Pronunciamiento_Subnacional_2024_240624.pdf,2024.0,5 de julio de 2024,,6,28,"En cuanto al cumplimiento de las reglas fiscales subnacionales, el CF nuevamente alerta sobre la existencia de un grupo de gobiernos locales que vienen incumpliendo la regla fiscal del Saldo de Deuda Total desde 2017, revelando la dificultad de poder reducir dicha deuda cuando esta es muy elevada, y cuyo persistente incumplimiento podría afectar la provisión de servicios públicos en estos gobiernos locales a alrededor de 3 millones de habitantes. En esa línea, el CF considera oportuno que se aborde en forma seria la situación de los gobiernos municipales con clara insolvencia y se evalúen mecanismos que permitan reestructurar sus endeudamientos con compromisos serios por parte de las autoridades locales de un manejo prudente de sus finanzas y no volver a caer en la actual situación.","{'sequence': 'En cuanto al cumplimiento de las reglas fiscales subnacionales, el CF nuevamente alerta sobre la existencia de un grupo de gobiernos locales que vienen incumpliendo la regla fiscal del Saldo de Deuda Total desde 2017, revelando la dificultad de poder reducir dicha deuda cuando esta es muy elevada, y cuyo persistente incumplimiento podría afectar la provisión de servicios públicos en estos gobiernos locales a alrededor de 3 millones de habitantes. En esa línea, el CF considera oportuno que se aborde en forma seria la situación de los gobiernos municipales con clara insolvencia y se evalúen mecanismos que permitan reestructurar sus endeudamientos con compromisos serios por parte de las autoridades locales de un manejo prudente de sus finanzas y no volver a caer en la actual situación.', 'labels': ['Riesgo de sostenibilidad de la deuda', 'Incumplimiento de metas fiscales', 'Gestión fiscal dentro del marco previsto', 'Riesgo fiscal potencial', 'Cumplimiento de metas fiscales', 'Desviación del déficit fiscal', 'Transparencia fiscal efectiva', 'Consolidación fiscal sostenida'], 'scores': [0.8435710072517395, 0.8179899454116821, 0.6999402046203613, 0.6589956879615784, 0.4290778338909149, 0.391081303358078, 0.22801357507705688, 0.1649531126022339]}"
Pronunciamiento_Subnacional_2024_240624.pdf,2024.0,5 de julio de 2024,,6,30,"En cuanto a la deuda de la MML, el CF reitera su preocupación ante el incremento que experimentaría de concretarse sus planes de endeudamiento anunciados. Asimismo, el CF advierte que la potencial materialización de contingencias por arbitrajes internacionales podría incrementar aún más los niveles de deuda. En esta situación, y en línea con la opinión de la Contraloría General de la República, el CF alerta que de continuar incrementándose el nivel de deuda de la MML esto podría afectar la provisión de servicios públicos de esta entidad y la gobernanza de subsiguientes administraciones.","{'sequence': 'En cuanto a la deuda de la MML, el CF reitera su preocupación ante el incremento que experimentaría de concretarse sus planes de endeudamiento anunciados. Asimismo, el CF advierte que la potencial materialización de contingencias por arbitrajes internacionales podría incrementar aún más los niveles de deuda. En esta situación, y en línea con la opinión de la Contraloría General de la República, el CF alerta que de continuar incrementándose el nivel de deuda de la MML esto podría afectar la provisión de servicios públicos de esta entidad y la gobernanza de subsiguientes administraciones.', 'labels': ['Riesgo de sostenibilidad de la deuda', 'Gestión fiscal dentro del marco previsto', 'Riesgo fiscal potencial', 'Cumplimiento de metas fiscales', 'Transparencia fiscal efectiva', 'Consolidación fiscal sostenida', 'Desviación del déficit fiscal', 'Incumplimiento de metas fiscales'], 'scores': [0.9325057864189148, 0.9011009335517883, 0.8905132412910461, 0.6753848791122437, 0.5714338421821594, 0.4684069752693176, 0.4512423574924469, 0.39147940278053284]}"
Pronunciamiento_Subnacional_2024_240624.pdf,2024.0,5 de julio de 2024,,6,31,"Finalmente, el CF recomienda incluir en el IAECRF una sección dedicada al seguimiento de las finanzas públicas de aquellos gobiernos locales que presentan el incumplimiento recurrente de la regla de SDT y que mantienen en niveles elevados de deuda desde hace varios años. Esto se debería complementar con el seguimiento de aquellos gobiernos subnacionales que podrían entrar en esta situación a corto o mediano plazo, con un análisis más prospectivo y no sólo retrospectivo sobre posibles riesgos fiscales.","{'sequence': 'Finalmente, el CF recomienda incluir en el IAECRF una sección dedicada al seguimiento de las finanzas públicas de aquellos gobiernos locales que presentan el incumplimiento recurrente de la regla de SDT y que mantienen en niveles elevados de deuda desde hace varios años. Esto se debería complementar con el seguimiento de aquellos gobiernos subnacionales que podrían entrar en esta situación a corto o mediano plazo, con un análisis más prospectivo y no sólo retrospectivo sobre posibles riesgos fiscales.', 'labels': ['Riesgo de sostenibilidad de la deuda', 'Riesgo fiscal potencial', 'Incumplimiento de metas fiscales', 'Gestión fiscal dentro del marco previsto', 'Cumplimiento de metas fiscales', 'Transparencia fiscal efectiva', 'Desviación del déficit fiscal', 'Consolidación fiscal sostenida'], 'scores': [0.8895043730735779, 0.8456342816352844, 0.8442719578742981, 0.8026742339134216, 0.4227660298347473, 0.34065869450569153, 0.32818761467933655, 0.18603231012821198]}"
Comunicado042024-VF.pdf,2024.0,9 de octubre de 2024,,1,1,"El Consejo Fiscal (CF), cumpliendo su objeto de contribuir con la gestión transparente y responsable de la política fiscal, expresa su profunda preocupación por la gestión de la política fiscal, que está conduciendo a un marcado deterioro de las fortalezas fiscales del país en los últimos años. La reciente gestión de la política fiscal ha provocado un incremento descontrolado del déficit fiscal, impulsado por la disminución de los ingresos fiscales y el incremento del gasto público, erosionando la credibilidad sobre los principales compromisos de política fiscal y llevando a incumplimientos, que podrían tornarse reiterados, de las reglas fiscales que tanto bien han hecho al país.","{'sequence': 'El Consejo Fiscal (CF), cumpliendo su objeto de contribuir con la gestión transparente y responsable de la política fiscal, expresa su profunda preocupación por la gestión de la política fiscal, que está conduciendo a un marcado deterioro de las fortalezas fiscales del país en los últimos años. La reciente gestión de la política fiscal ha provocado un incremento descontrolado del déficit fiscal, impulsado por la disminución de los ingresos fiscales y el incremento del gasto público, erosionando la credibilidad sobre los principales compromisos de política fiscal y llevando a incumplimientos, que podrían tornarse reiterados, de las reglas fiscales que tanto bien han hecho al país.', 'labels': ['Incumplimiento de metas fiscales', 'Gestión fiscal dentro del marco previsto', 'Cumplimiento de metas fiscales', 'Transparencia fiscal efectiva', 'Riesgo fiscal potencial', 'Desviación del déficit fiscal', 'Consolidación fiscal sostenida', 'Riesgo de sostenibilidad de la deuda'], 'scores': [0.9516457319259644, 0.9102155566215515, 0.8603717684745789, 0.8603496551513672, 0.8208495378494263, 0.7288585305213928, 0.5489238500595093, 0.5447672009468079]}"
Comunicado042024-VF.pdf,2024.0,9 de octubre de 2024,,1,2,"La actual gestión fiscal está exponiendo al país a múltiples riesgos fiscales, sobre los cuales el CF ya ha emitido alertas, de no ser atendidos, podrían devenir en nuevos incumplimientos de las reglas fiscales o comprometer la sostenibilidad fiscal a mediano y largo plazo. Estos riesgos incluyen la aprobación de la reforma del sistema previsional sin un estudio técnico adecuado sobre su costo actuarial, el continuo apoyo financiero a Petroperú con recursos del Tesoro Público sin una estrategia concreta para su sostenibilidad financiera, el creciente endeudamiento de la Municipalidad Metropolitana de Lima (MML) que podría constreñir su capacidad de prestación de bienes y servicios futuros, y una serie de decisiones en la gestión presupuestal de parte del Ejecutivo que rompen con buenas prácticas de prudencia y responsabilidad que han caracterizado a la gestión fiscal del país.","{'sequence': 'La actual gestión fiscal está exponiendo al país a múltiples riesgos fiscales, sobre los cuales el CF ya ha emitido alertas, de no ser atendidos, podrían devenir en nuevos incumplimientos de las reglas fiscales o comprometer la sostenibilidad fiscal a mediano y largo plazo. Estos riesgos incluyen la aprobación de la reforma del sistema previsional sin un estudio técnico adecuado sobre su costo actuarial, el continuo apoyo financiero a Petroperú con recursos del Tesoro Público sin una estrategia concreta para su sostenibilidad financiera, el creciente endeudamiento de la Municipalidad Metropolitana de Lima (MML) que podría constreñir su capacidad de prestación de bienes y servicios futuros, y una serie de decisiones en la gestión presupuestal de parte del Ejecutivo que rompen con buenas prácticas de prudencia y responsabilidad que han caracterizado a la gestión fiscal del país.', 'labels': ['Riesgo fiscal potencial', 'Incumplimiento de metas fiscales', 'Cumplimiento de metas fiscales', 'Gestión fiscal dentro del marco previsto', 'Riesgo de sostenibilidad de la deuda', 'Consolidación fiscal sostenida', 'Transparencia fiscal efectiva', 'Desviación del déficit fiscal'], 'scores': [0.8488378524780273, 0.8289734721183777, 0.7734518051147461, 0.6749630570411682, 0.5033015608787537, 0.4032236933708191, 0.2080104500055313, 0.20323465764522552]}"
Comunicado042024-VF.pdf,2024.0,9 de octubre de 2024,,1,3,"Con relación al déficit fiscal, es preciso señalar que durante 2023 y lo que va de 2024, este ha crecido de manera preocupante. Así, al cierre de agosto, el déficit del Sector Público No Financiero (acumulado en los últimos 12 meses) se mantuvo por cuarto mes consecutivo en 4,0 por ciento del PBI, superando en 1,2 puntos porcentuales (puntos porcentuales) al límite recientemente modificado al alza para este año (2,8 por ciento del PBI). Esta tendencia apunta a un incumplimiento de la regla del déficit fiscal por segundo año consecutivo, a pesar de que los documentos oficiales de política económica indican que la consolidación fiscal debería estar en marcha. De no corregirse esta situación, este sería el cuarto incumplimiento de las reglas fiscales desde su implementación en el año 2000, con el agravante de ser el segundo año consecutivo en que esto ocurre y el primero en que se incumpliría en el mismo año en que se flexibilizó la regla. La reiteración del incumplimiento debilita seriamente la credibilidad fiscal del país, con posibles consecuencias en su calificación crediticia en el corto y mediano plazo y, con ello, un aumento en los costos de financiamiento para el sector público y privado.","{'sequence': 'Con relación al déficit fiscal, es preciso señalar que durante 2023 y lo que va de 2024, este ha crecido de manera preocupante. Así, al cierre de agosto, el déficit del Sector Público No Financiero (acumulado en los últimos 12 meses) se mantuvo por cuarto mes consecutivo en 4,0 por ciento del PBI, superando en 1,2 puntos porcentuales (puntos porcentuales) al límite recientemente modificado al alza para este año (2,8 por ciento del PBI). Esta tendencia apunta a un incumplimiento de la regla del déficit fiscal por segundo año consecutivo, a pesar de que los documentos oficiales de política económica indican que la consolidación fiscal debería estar en marcha. De no corregirse esta situación, este sería el cuarto incumplimiento de las reglas fiscales desde su implementación en el año 2000, con el agravante de ser el segundo año consecutivo en que esto ocurre y el primero en que se incumpliría en el mismo año en que se flexibilizó la regla. La reiteración del incumplimiento debilita seriamente la credibilidad fiscal del país, con posibles consecuencias en su calificación crediticia en el corto y mediano plazo y, con ello, un aumento en los costos de financiamiento para el sector público y privado.', 'labels': ['Gestión fiscal dentro del marco previsto', 'Riesgo fiscal potencial', 'Incumplimiento de metas fiscales', 'Cumplimiento de metas fiscales', 'Transparencia fiscal efectiva', 'Desviación del déficit fiscal', 'Riesgo de sostenibilidad de la deuda', 'Consolidación fiscal sostenida'], 'scores': [0.8870298266410828, 0.7788439989089966, 0.6174876689910889, 0.420979380607605, 0.3672848641872406, 0.3660987615585327, 0.35600143671035767, 0.05568297952413559]}"
Comunicado042024-VF.pdf,2024.0,9 de octubre de 2024,,2,4,"En este contexto, el CF subraya la urgencia de adoptar medidas que reduzcan el déficit fiscal, vía moderación en el incremento del gasto público o el incremento de los ingresos permanentes.","{'sequence': 'En este contexto, el CF subraya la urgencia de adoptar medidas que reduzcan el déficit fiscal, vía moderación en el incremento del gasto público o el incremento de los ingresos permanentes.', 'labels': ['Desviación del déficit fiscal', 'Cumplimiento de metas fiscales', 'Gestión fiscal dentro del marco previsto', 'Riesgo fiscal potencial', 'Transparencia fiscal efectiva', 'Consolidación fiscal sostenida', 'Incumplimiento de metas fiscales', 'Riesgo de sostenibilidad de la deuda'], 'scores': [0.983380913734436, 0.8286311030387878, 0.7110887765884399, 0.43960705399513245, 0.3800736963748932, 0.2758159041404724, 0.1618478000164032, 0.10586251318454742]}"
Comunicado042024-VF.pdf,2024.0,9 de octubre de 2024,,3,10,"Más allá de las medidas en sí mismas, el CF considera que el principal riesgo fiscal derivado de Petroperú radica en su alto grado de apalancamiento y en que su operatividad implique una situación permanentemente deficitaria. En los últimos años, Petroperú ha registrado niveles de déficit primario y de pagos de intereses significativamente superiores al resto de empresas públicas no financieras, y a junio explicaba entre 0,3 y 0,4 puntos porcentuales del déficit fiscal acumulado (4,0 por ciento del PBI). Si bien la entrada en funcionamiento de la modernizada refinería de Talara debería impactar positivamente en los resultados financieros de la empresa, ello no asegura que el margen sea suficiente para garantizar su sostenibilidad financiera dadas sus notorias ineficiencias y elevados gastos, la fuerte pérdida de participación de mercado en años recientes y el elevado endeudamiento ya contraído. Ante ello, el CF reitera la importancia de que se tomen medidas correctivas para lograr que la gestión de Petroperú se rija bajo criterios de transparencia y buen gobierno corporativo, en línea con las mejores prácticas internacionales.","{'sequence': 'Más allá de las medidas en sí mismas, el CF considera que el principal riesgo fiscal derivado de Petroperú radica en su alto grado de apalancamiento y en que su operatividad implique una situación permanentemente deficitaria. En los últimos años, Petroperú ha registrado niveles de déficit primario y de pagos de intereses significativamente superiores al resto de empresas públicas no financieras, y a junio explicaba entre 0,3 y 0,4 puntos porcentuales del déficit fiscal acumulado (4,0 por ciento del PBI). Si bien la entrada en funcionamiento de la modernizada refinería de Talara debería impactar positivamente en los resultados financieros de la empresa, ello no asegura que el margen sea suficiente para garantizar su sostenibilidad financiera dadas sus notorias ineficiencias y elevados gastos, la fuerte pérdida de participación de mercado en años recientes y el elevado endeudamiento ya contraído. Ante ello, el CF reitera la importancia de que se tomen medidas correctivas para lograr que la gestión de Petroperú se rija bajo criterios de transparencia y buen gobierno corporativo, en línea con las mejores prácticas internacionales.', 'labels': ['Gestión fiscal dentro del marco previsto', 'Transparencia fiscal efectiva', 'Riesgo fiscal potencial', 'Cumplimiento de metas fiscales', 'Incumplimiento de metas fiscales', 'Consolidación fiscal sostenida', 'Desviación del déficit fiscal', 'Riesgo de sostenibilidad de la deuda'], 'scores': [0.8616060614585876, 0.8247782588005066, 0.7826827168464661, 0.7514546513557434, 0.6957859396934509, 0.6405048370361328, 0.5959004759788513, 0.3902093470096588]}"
Comunicado042024-VF.pdf,2024.0,9 de octubre de 2024,,3,11,"Con relación a la Municipalidad Metropolitana de Lima (MML), el CF nuevamente expresa su preocupación ante el incremento de sus niveles de endeudamiento como consecuencia de la segunda operación de emisión de bonos que ascendió a S/ 1 250 millones. Con esta nueva operación de endeudamiento, el ratio del saldo de deuda total a ingresos de la MML se ubicaría en aproximadamente 300 por ciento, triplicando el límite máximo de la regla fiscal regular para los gobiernos subnacionales (100 por ciento,). En ese sentido, el CF se reafirma en señalar que la actual gestión de la MML está sobreendeudando a la entidad. Ante ello, preocupa que: (i) se haya comprometido, exclusivamente para el pago del servicio de la deuda, y por un periodo de 20 años, sus ingresos por alcabala e impuesto al patrimonio vehicular, que representan aproximadamente el 35 por ciento del total de ingresos; (ii) la imposibilidad de que la MML haga frente a sus obligaciones financieras (servicio de la deuda) y a la vez sostener niveles “normales” de gasto no financiero, principalmente gasto de capital, y (iii) el sobrecosto financiero de aproximadamente S/ 42 millones por año en promedio durante el periodo de repago de la deuda, derivado de la emisión directa de los bonos por parte de la MML y sin garantía del Gobierno Nacional.","{'sequence': 'Con relación a la Municipalidad Metropolitana de Lima (MML), el CF nuevamente expresa su preocupación ante el incremento de sus niveles de endeudamiento como consecuencia de la segunda operación de emisión de bonos que ascendió a S/ 1 250 millones. Con esta nueva operación de endeudamiento, el ratio del saldo de deuda total a ingresos de la MML se ubicaría en aproximadamente 300 por ciento, triplicando el límite máximo de la regla fiscal regular para los gobiernos subnacionales (100 por ciento,). En ese sentido, el CF se reafirma en señalar que la actual gestión de la MML está sobreendeudando a la entidad. Ante ello, preocupa que: (i) se haya comprometido, exclusivamente para el pago del servicio de la deuda, y por un periodo de 20 años, sus ingresos por alcabala e impuesto al patrimonio vehicular, que representan aproximadamente el 35 por ciento del total de ingresos; (ii) la imposibilidad de que la MML haga frente a sus obligaciones financieras (servicio de la deuda) y a la vez sostener niveles “normales” de gasto no financiero, principalmente gasto de capital, y (iii) el sobrecosto financiero de aproximadamente S/ 42 millones por año en promedio durante el periodo de repago de la deuda, derivado de la emisión directa de los bonos por parte de la MML y sin garantía del Gobierno Nacional.', 'labels': ['Riesgo de sostenibilidad de la deuda', 'Riesgo fiscal potencial', 'Gestión fiscal dentro del marco previsto', 'Cumplimiento de metas fiscales', 'Transparencia fiscal efectiva', 'Incumplimiento de metas fiscales', 'Desviación del déficit fiscal', 'Consolidación fiscal sostenida'], 'scores': [0.9719606041908264, 0.8122549653053284, 0.7466706037521362, 0.4120233952999115, 0.38450613617897034, 0.3661893904209137, 0.25276294350624084, 0.19542792439460754]}"
