filename,year,date,announcement,page,paragraph_id,text,sentiment
Pronunciamiento-MMM-24-27-VF-nota-aclaratoria-VF.pdf,2023.0,15 de agosto de 2023,,20,102,"El CF considera positivo que el desarrollo de una sección de riesgos fiscales se haya convertido en una práctica permanente en la elaboración del MMM. No obstante, el CF opina que el MMM todavía no incorpora una evaluación rigurosa de los efectos sobre las proyecciones macrofiscales y el cumplimiento de reglas que tendrían muchos de los riesgos que afectan a la economía peruana.","{'sequence': 'El CF considera positivo que el desarrollo de una sección de riesgos fiscales se haya convertido en una práctica permanente en la elaboración del MMM. No obstante, el CF opina que el MMM todavía no incorpora una evaluación rigurosa de los efectos sobre las proyecciones macrofiscales y el cumplimiento de reglas que tendrían muchos de los riesgos que afectan a la economía peruana.', 'labels': ['Gestión fiscal dentro del marco previsto', 'Riesgo fiscal potencial', 'Cumplimiento de metas fiscales', 'Riesgo de sostenibilidad de la deuda', 'Consolidación fiscal sostenida', 'Incumplimiento de metas fiscales', 'Desviación del déficit fiscal', 'Transparencia fiscal efectiva'], 'scores': [0.7379137277603149, 0.5833755731582642, 0.4949460029602051, 0.3901344835758209, 0.37041473388671875, 0.33958137035369873, 0.1819288432598114, 0.1409594565629959]}"
Pronunciamiento-MMM-24-27-VF-nota-aclaratoria-VF.pdf,2023.0,15 de agosto de 2023,,20,104,"Adicionalmente, el CF expresa su preocupación por dos riesgos específicos que no han sido mencionados en el MMM. En primer lugar, el CF resalta que la situación financiera de Petroperú S.A. sigue siendo preocupante, a pesar de los apoyos financieros brindados por el gobierno en 2022. En segundo lugar, el CF resalta que la reciente controversia de la Municipalidad .pe","{'sequence': 'Adicionalmente, el CF expresa su preocupación por dos riesgos específicos que no han sido mencionados en el MMM. En primer lugar, el CF resalta que la situación financiera de Petroperú S.A. sigue siendo preocupante, a pesar de los apoyos financieros brindados por el gobierno en 2022. En segundo lugar, el CF resalta que la reciente controversia de la Municipalidad .pe', 'labels': ['Riesgo de sostenibilidad de la deuda', 'Riesgo fiscal potencial', 'Gestión fiscal dentro del marco previsto', 'Incumplimiento de metas fiscales', 'Desviación del déficit fiscal', 'Cumplimiento de metas fiscales', 'Transparencia fiscal efectiva', 'Consolidación fiscal sostenida'], 'scores': [0.8836456537246704, 0.8645641803741455, 0.6552966237068176, 0.4840686023235321, 0.30477777123451233, 0.17607878148555756, 0.14589785039424896, 0.09183622896671295]}"
Pronunciamiento-MMM-24-27-VF-nota-aclaratoria-VF.pdf,2023.0,15 de agosto de 2023,,21,106,"El CF reitera que, en el mediano plazo, los principales riesgos fiscales radican en los factores que pueden generar desviaciones permanentes en la dinámica del déficit fiscal. Por el lado de los ingresos, un escenario de bajo crecimiento que conlleve a una reducción adicional del crecimiento potencial y menores precios de exportación son factores que reducirían la recaudación tributaria de forma permanente. En el caso del gasto no financiero, presiones de gasto provenientes de normas y medidas impulsadas tanto por el Poder Legislativo como Ejecutivo podrían incrementar significativamente el tamaño del gasto público.","{'sequence': 'El CF reitera que, en el mediano plazo, los principales riesgos fiscales radican en los factores que pueden generar desviaciones permanentes en la dinámica del déficit fiscal. Por el lado de los ingresos, un escenario de bajo crecimiento que conlleve a una reducción adicional del crecimiento potencial y menores precios de exportación son factores que reducirían la recaudación tributaria de forma permanente. En el caso del gasto no financiero, presiones de gasto provenientes de normas y medidas impulsadas tanto por el Poder Legislativo como Ejecutivo podrían incrementar significativamente el tamaño del gasto público.', 'labels': ['Desviación del déficit fiscal', 'Riesgo fiscal potencial', 'Gestión fiscal dentro del marco previsto', 'Cumplimiento de metas fiscales', 'Incumplimiento de metas fiscales', 'Transparencia fiscal efectiva', 'Riesgo de sostenibilidad de la deuda', 'Consolidación fiscal sostenida'], 'scores': [0.9814395308494568, 0.7838346362113953, 0.7706228494644165, 0.6253516674041748, 0.3173266351222992, 0.2841848134994507, 0.24811021983623505, 0.07885579019784927]}"
Pronunciamiento-FinanzasPublicas2022-vF.pdf,2023.0,30 de junio de 2023,,8,44,"para el crecimiento del GNFGG y del gasto corriente del Gobierno General. Esto generó espacio para la ejecución de gastos no previstos en el presupuesto de apertura (medidas) por más de S/ 10 mil millones (aproximadamente 1 puntos porcentuales del PBI), sin incumplir las reglas fiscales de gasto. De este modo, si se excluyera de la contabilidad de las reglas fiscales aquellos gastos en medidas que son de naturaleza transitoria, el GNFFF hubiese crecido 8,4 por ciento en términos reales y el gasto corriente sin mantenimiento hubiese crecido 5,3 por ciento en términos reales, por encima en ambos casos de los límites establecidos en las reglas fiscales vigentes (límites de 5,2 y 3,2 por ciento real, respectivamente). Considerando que para los próximos años se tiene prevista una senda de consolidación fiscal, el CF considera que limitar el crecimiento de los gastos de naturaleza más permanente (sin medidas) a los parámetros de las reglas fiscales de gasto, al tiempo que se mejora su eficiencia, facilitará el cumplimiento de aquel objetivo. Del mismo modo, el CF nota que, por el diseño de las reglas fiscales de gasto, los gastos temporales o extraordinarios brindan espacio en el año fiscal siguiente para acomodar mayores gastos, lo que permite extender la temporalidad de los desvíos. En ese sentido, una revisión futura del diseño de las reglas fiscales podría contemplar mecanismos que resuelvan dicho problema.","{'sequence': 'para el crecimiento del GNFGG y del gasto corriente del Gobierno General. Esto generó espacio para la ejecución de gastos no previstos en el presupuesto de apertura (medidas) por más de S/ 10 mil millones (aproximadamente 1 puntos porcentuales del PBI), sin incumplir las reglas fiscales de gasto. De este modo, si se excluyera de la contabilidad de las reglas fiscales aquellos gastos en medidas que son de naturaleza transitoria, el GNFFF hubiese crecido 8,4 por ciento en términos reales y el gasto corriente sin mantenimiento hubiese crecido 5,3 por ciento en términos reales, por encima en ambos casos de los límites establecidos en las reglas fiscales vigentes (límites de 5,2 y 3,2 por ciento real, respectivamente). Considerando que para los próximos años se tiene prevista una senda de consolidación fiscal, el CF considera que limitar el crecimiento de los gastos de naturaleza más permanente (sin medidas) a los parámetros de las reglas fiscales de gasto, al tiempo que se mejora su eficiencia, facilitará el cumplimiento de aquel objetivo. Del mismo modo, el CF nota que, por el diseño de las reglas fiscales de gasto, los gastos temporales o extraordinarios brindan espacio en el año fiscal siguiente para acomodar mayores gastos, lo que permite extender la temporalidad de los desvíos. En ese sentido, una revisión futura del diseño de las reglas fiscales podría contemplar mecanismos que resuelvan dicho problema.', 'labels': ['Gestión fiscal dentro del marco previsto', 'Incumplimiento de metas fiscales', 'Consolidación fiscal sostenida', 'Cumplimiento de metas fiscales', 'Transparencia fiscal efectiva', 'Riesgo fiscal potencial', 'Desviación del déficit fiscal', 'Riesgo de sostenibilidad de la deuda'], 'scores': [0.9343610405921936, 0.6213235855102539, 0.5843316316604614, 0.5418184399604797, 0.4778399169445038, 0.46038275957107544, 0.3819355070590973, 0.2257959544658661]}"
Pronunciamiento-FinanzasPublicas2022-vF.pdf,2023.0,30 de junio de 2023,,8,46,"El CF nota que la reducción del resultado primario de las empresas públicas no financieras en 2022 (0,3 puntos porcentuales del PBI) atenuó la reducción del déficit fiscal en dicho año y se explicó, principalmente, por el deterioro del resultado primario de Petroperú (0,2 puntos porcentuales del PBI). Ante ello, el CF reitera su recomendación de monitorear e informar oportunamente, con la mayor transparencia posible, la situación financiera de Petroperú, en especial considerando que el gobierno otorgó un apoyo financiero significativo a la empresa estatal a lo largo del 2022.","{'sequence': 'El CF nota que la reducción del resultado primario de las empresas públicas no financieras en 2022 (0,3 puntos porcentuales del PBI) atenuó la reducción del déficit fiscal en dicho año y se explicó, principalmente, por el deterioro del resultado primario de Petroperú (0,2 puntos porcentuales del PBI). Ante ello, el CF reitera su recomendación de monitorear e informar oportunamente, con la mayor transparencia posible, la situación financiera de Petroperú, en especial considerando que el gobierno otorgó un apoyo financiero significativo a la empresa estatal a lo largo del 2022.', 'labels': ['Transparencia fiscal efectiva', 'Gestión fiscal dentro del marco previsto', 'Desviación del déficit fiscal', 'Cumplimiento de metas fiscales', 'Incumplimiento de metas fiscales', 'Riesgo fiscal potencial', 'Riesgo de sostenibilidad de la deuda', 'Consolidación fiscal sostenida'], 'scores': [0.9532271027565002, 0.9041664600372314, 0.8200162053108215, 0.607319712638855, 0.5649900436401367, 0.4481501877307892, 0.40760335326194763, 0.2378164827823639]}"
Pronunciamiento-FinanzasPublicas2022-vF.pdf,2023.0,30 de junio de 2023,,9,49,"El CF considera que la recomposición del FEF y la RSL registrada en 2022 representa un paso favorable para la recuperación de las cuentas fiscales luego de la pandemia, pues contar disponibilidad de activos líquidos es conveniente para la atención oportuna de posibles crisis futuras de envergadura. A pesar de la recuperación de activos financieros estratégicos, el CF considera que regresar a la situación fiscal prepandemia, en términos de endeudamiento neto, será retador y requerirá de un largo esfuerzo de consolidación fiscal en el mediano y largo plazo, además de medidas que favorezcan un crecimiento sostenido de la economía.","{'sequence': 'El CF considera que la recomposición del FEF y la RSL registrada en 2022 representa un paso favorable para la recuperación de las cuentas fiscales luego de la pandemia, pues contar disponibilidad de activos líquidos es conveniente para la atención oportuna de posibles crisis futuras de envergadura. A pesar de la recuperación de activos financieros estratégicos, el CF considera que regresar a la situación fiscal prepandemia, en términos de endeudamiento neto, será retador y requerirá de un largo esfuerzo de consolidación fiscal en el mediano y largo plazo, además de medidas que favorezcan un crecimiento sostenido de la economía.', 'labels': ['Consolidación fiscal sostenida', 'Gestión fiscal dentro del marco previsto', 'Cumplimiento de metas fiscales', 'Incumplimiento de metas fiscales', 'Transparencia fiscal efectiva', 'Desviación del déficit fiscal', 'Riesgo fiscal potencial', 'Riesgo de sostenibilidad de la deuda'], 'scores': [0.9511903524398804, 0.8929058313369751, 0.816787838935852, 0.6118303537368774, 0.6100404858589172, 0.6075820922851562, 0.5677455067634583, 0.5293304324150085]}"
Pronunciamiento-FinanzasPublicas2022-vF.pdf,2023.0,30 de junio de 2023,,9,51,"Considerando que ese programa ha estado sujeto a reprogramaciones y que todavía existen garantías vigentes, el CF opina que Reactiva Perú representa un riesgo fiscal relevante que debe ser monitoreado y transparentado, y cuya trayectoria debe ser parte de los reportes sobre riesgos fiscales emitidos por el MEF.","{'sequence': 'Considerando que ese programa ha estado sujeto a reprogramaciones y que todavía existen garantías vigentes, el CF opina que Reactiva Perú representa un riesgo fiscal relevante que debe ser monitoreado y transparentado, y cuya trayectoria debe ser parte de los reportes sobre riesgos fiscales emitidos por el MEF.', 'labels': ['Riesgo fiscal potencial', 'Gestión fiscal dentro del marco previsto', 'Riesgo de sostenibilidad de la deuda', 'Cumplimiento de metas fiscales', 'Transparencia fiscal efectiva', 'Incumplimiento de metas fiscales', 'Desviación del déficit fiscal', 'Consolidación fiscal sostenida'], 'scores': [0.9810440540313721, 0.7539849281311035, 0.5464992523193359, 0.18240156769752502, 0.080850750207901, 0.06584493815898895, 0.03269219025969505, 0.004268069751560688]}"
Pronunciamiento-FinanzasPublicas2022-vF.pdf,2023.0,30 de junio de 2023,,10,54,"variaciones de gran magnitud, lo que las convierte en una fuente de ingresos poco predecible. Esta situación adquiere mayor relevancia debido a que las transferencias RRNN constituyen una fuente de financiamiento importante del gasto de capital subnacional. En este contexto, el CF reafirma su recomendación de evaluar la implementación de un mecanismo de estabilización de las transferencias RRNN, con el objetivo de brindar mayor predictibilidad de los gastos de capital de los gobiernos subnacionales.","{'sequence': 'variaciones de gran magnitud, lo que las convierte en una fuente de ingresos poco predecible. Esta situación adquiere mayor relevancia debido a que las transferencias RRNN constituyen una fuente de financiamiento importante del gasto de capital subnacional. En este contexto, el CF reafirma su recomendación de evaluar la implementación de un mecanismo de estabilización de las transferencias RRNN, con el objetivo de brindar mayor predictibilidad de los gastos de capital de los gobiernos subnacionales.', 'labels': ['Gestión fiscal dentro del marco previsto', 'Riesgo fiscal potencial', 'Transparencia fiscal efectiva', 'Consolidación fiscal sostenida', 'Cumplimiento de metas fiscales', 'Desviación del déficit fiscal', 'Incumplimiento de metas fiscales', 'Riesgo de sostenibilidad de la deuda'], 'scores': [0.8015762567520142, 0.5838301777839661, 0.5191693902015686, 0.39774900674819946, 0.39700353145599365, 0.18663759529590607, 0.1738608479499817, 0.14323966205120087]}"
Pronunciamiento-FinanzasPublicas2022-vF.pdf,2023.0,30 de junio de 2023,,10,55,"En cuanto al cumplimiento de las reglas fiscales subnacionales, el CF destaca nuevamente la existencia de un grupo de 32 gobiernos locales que vienen incumpliendo la regla de SDT desde la implementación del MRTF-SN en 2017. Estos gobiernos locales representan más de la mitad de los gobiernos locales que incumplieron dicha regla fiscal en 2022. Asimismo, estos gobiernos locales concentraron el 31,2 por ciento de toda la deuda en este nivel de gobierno. Frente a esta situación recurrente y que el CF ha venido alertando, el CF reafirma la necesidad de evaluar la implementación de mecanismos focalizados que permitan prevenir escenarios de insolvencia en dichas jurisdicciones, que podrían afectar negativamente la provisión de servicios públicos para más de 3 millones de personas residentes.","{'sequence': 'En cuanto al cumplimiento de las reglas fiscales subnacionales, el CF destaca nuevamente la existencia de un grupo de 32 gobiernos locales que vienen incumpliendo la regla de SDT desde la implementación del MRTF-SN en 2017. Estos gobiernos locales representan más de la mitad de los gobiernos locales que incumplieron dicha regla fiscal en 2022. Asimismo, estos gobiernos locales concentraron el 31,2 por ciento de toda la deuda en este nivel de gobierno. Frente a esta situación recurrente y que el CF ha venido alertando, el CF reafirma la necesidad de evaluar la implementación de mecanismos focalizados que permitan prevenir escenarios de insolvencia en dichas jurisdicciones, que podrían afectar negativamente la provisión de servicios públicos para más de 3 millones de personas residentes.', 'labels': ['Gestión fiscal dentro del marco previsto', 'Incumplimiento de metas fiscales', 'Riesgo fiscal potencial', 'Cumplimiento de metas fiscales', 'Riesgo de sostenibilidad de la deuda', 'Desviación del déficit fiscal', 'Transparencia fiscal efectiva', 'Consolidación fiscal sostenida'], 'scores': [0.8242522478103638, 0.6912620067596436, 0.5486031770706177, 0.5339704155921936, 0.5041017532348633, 0.45293810963630676, 0.3948279023170471, 0.21779987215995789]}"
Pronunciamiento-FinanzasPublicas2022-vF.pdf,2023.0,30 de junio de 2023,,11,57,"financiera. Por estos motivos, el CF reitera su recomendación de no considerar solamente la calificación crediticia de las entidades subnacionales como un parámetro para estar exento de las reglas fiscales subnacionales. Adicionalmente, el CF expresa su preocupación ante la potencial materialización de posibles contingencias o de nuevas operaciones de endeudamiento que podrían afectar aún más la situación fiscal de la MML. Por estos motivos, considerando la relevancia fiscal y social de la MML, el CF recomienda a la propia municipalidad a realizar un monitoreo pormenorizado y constante de su situación fiscal, para evitar situaciones que puedan afectar la provisión de servicios públicos a la ciudadanía.","{'sequence': 'financiera. Por estos motivos, el CF reitera su recomendación de no considerar solamente la calificación crediticia de las entidades subnacionales como un parámetro para estar exento de las reglas fiscales subnacionales. Adicionalmente, el CF expresa su preocupación ante la potencial materialización de posibles contingencias o de nuevas operaciones de endeudamiento que podrían afectar aún más la situación fiscal de la MML. Por estos motivos, considerando la relevancia fiscal y social de la MML, el CF recomienda a la propia municipalidad a realizar un monitoreo pormenorizado y constante de su situación fiscal, para evitar situaciones que puedan afectar la provisión de servicios públicos a la ciudadanía.', 'labels': ['Gestión fiscal dentro del marco previsto', 'Cumplimiento de metas fiscales', 'Riesgo fiscal potencial', 'Transparencia fiscal efectiva', 'Consolidación fiscal sostenida', 'Riesgo de sostenibilidad de la deuda', 'Incumplimiento de metas fiscales', 'Desviación del déficit fiscal'], 'scores': [0.8290040493011475, 0.7780787944793701, 0.7353753447532654, 0.7018517255783081, 0.5626159310340881, 0.5173746943473816, 0.45876917243003845, 0.34098514914512634]}"
Pronunciamiento-FinanzasPublicas2022-vF.pdf,2023.0,30 de junio de 2023,,11,60,"Respecto del gasto no financiero público, el CF observa que el cumplimiento de las reglas fiscales del gasto no financiero y del gasto corriente sin mantenimiento, fue facilitado por la ejecución, en el año fiscal previo, de altos niveles de gastos temporales asociados a la pandemia de la COVID-19 que elevó la base de comparación. El CF también nota que, si se considerara el gasto sin medidas para los años 2021 y 2022, el gasto ejecutado crecería por encima de los parámetros máximos establecidos para ambas reglas fiscales. En ese sentido, el CF sugiere hacer un control estricto del gasto sin medidas a partir del ejercicio fiscal 2023 para facilitar el cumplimiento de la senda de consolidación fiscal prevista para el mediano plazo, la cual prevé una racionalización importante de los niveles de gasto.","{'sequence': 'Respecto del gasto no financiero público, el CF observa que el cumplimiento de las reglas fiscales del gasto no financiero y del gasto corriente sin mantenimiento, fue facilitado por la ejecución, en el año fiscal previo, de altos niveles de gastos temporales asociados a la pandemia de la COVID-19 que elevó la base de comparación. El CF también nota que, si se considerara el gasto sin medidas para los años 2021 y 2022, el gasto ejecutado crecería por encima de los parámetros máximos establecidos para ambas reglas fiscales. En ese sentido, el CF sugiere hacer un control estricto del gasto sin medidas a partir del ejercicio fiscal 2023 para facilitar el cumplimiento de la senda de consolidación fiscal prevista para el mediano plazo, la cual prevé una racionalización importante de los niveles de gasto.', 'labels': ['Gestión fiscal dentro del marco previsto', 'Cumplimiento de metas fiscales', 'Incumplimiento de metas fiscales', 'Consolidación fiscal sostenida', 'Transparencia fiscal efectiva', 'Riesgo fiscal potencial', 'Desviación del déficit fiscal', 'Riesgo de sostenibilidad de la deuda'], 'scores': [0.881942868232727, 0.8261897563934326, 0.7361631989479065, 0.6016525626182556, 0.4953862726688385, 0.4518105387687683, 0.26441842317581177, 0.25710663199424744]}"
Pronunciamiento-FinanzasPublicas2022-vF.pdf,2023.0,30 de junio de 2023,,12,65,"Con relación a la evolución de las finanzas de los gobiernos subnacionales, el CF reitera su recomendación acerca de la implementación de un mecanismo de estabilización para los ingresos asociados a RRNN, con el objetivo de mejorar la previsibilidad y sostenibilidad de los gastos de capital, los cuales dependen en gran medida de esta fuente de financiamiento. Sobre el cumplimiento de las reglas fiscales aplicables a gobiernos regionales y locales, el CF resalta, una vez más, la existencia de un grupo de gobiernos locales con altos niveles de endeudamiento que vienen incumpliendo de manera recurrente la regla fiscal del SDT desde 2017. Por ello, el CF considera importante insistir en la necesidad de implementar mecanismos focalizados que permitan prevenir escenarios de insolvencia en dichas jurisdicciones que puedan afectar su capacidad de prestar servicios públicos a la población.","{'sequence': 'Con relación a la evolución de las finanzas de los gobiernos subnacionales, el CF reitera su recomendación acerca de la implementación de un mecanismo de estabilización para los ingresos asociados a RRNN, con el objetivo de mejorar la previsibilidad y sostenibilidad de los gastos de capital, los cuales dependen en gran medida de esta fuente de financiamiento. Sobre el cumplimiento de las reglas fiscales aplicables a gobiernos regionales y locales, el CF resalta, una vez más, la existencia de un grupo de gobiernos locales con altos niveles de endeudamiento que vienen incumpliendo de manera recurrente la regla fiscal del SDT desde 2017. Por ello, el CF considera importante insistir en la necesidad de implementar mecanismos focalizados que permitan prevenir escenarios de insolvencia en dichas jurisdicciones que puedan afectar su capacidad de prestar servicios públicos a la población.', 'labels': ['Incumplimiento de metas fiscales', 'Cumplimiento de metas fiscales', 'Gestión fiscal dentro del marco previsto', 'Riesgo fiscal potencial', 'Riesgo de sostenibilidad de la deuda', 'Transparencia fiscal efectiva', 'Consolidación fiscal sostenida', 'Desviación del déficit fiscal'], 'scores': [0.9764169454574585, 0.9233304858207703, 0.857370138168335, 0.6059494614601135, 0.5961291790008545, 0.5881482362747192, 0.581531822681427, 0.49972546100616455]}"
Pronunciamiento-FinanzasPublicas2022-vF.pdf,2023.0,30 de junio de 2023,,12,66,"Finalmente, el CF reitera que no considera adecuado exceptuar del cumplimiento de las reglas fiscales subnacionales a gobiernos regionales o locales en función únicamente de calificaciones crediticias, como es el caso de la Municipalidad Metropolitana de Lima (MML). Al respecto debe considerarse que las calificadoras de riesgo solo consideran la deuda financiera de la entidad a evaluar y suponen que el Gobierno Nacional actuará como garante (implícito) en situaciones de escasa capacidad de pago de la entidad subnacional evaluada. Asimismo, el CF expresa su preocupación por el posible incremento de la deuda de la MML, debido a la potencial materialización de contingencias. Por ello, considerando que la relevancia social y fiscal de la MML, el CF recomienda a la propia municipalidad a realizar un monitoreo constante de su situación fiscal.","{'sequence': 'Finalmente, el CF reitera que no considera adecuado exceptuar del cumplimiento de las reglas fiscales subnacionales a gobiernos regionales o locales en función únicamente de calificaciones crediticias, como es el caso de la Municipalidad Metropolitana de Lima (MML). Al respecto debe considerarse que las calificadoras de riesgo solo consideran la deuda financiera de la entidad a evaluar y suponen que el Gobierno Nacional actuará como garante (implícito) en situaciones de escasa capacidad de pago de la entidad subnacional evaluada. Asimismo, el CF expresa su preocupación por el posible incremento de la deuda de la MML, debido a la potencial materialización de contingencias. Por ello, considerando que la relevancia social y fiscal de la MML, el CF recomienda a la propia municipalidad a realizar un monitoreo constante de su situación fiscal.', 'labels': ['Gestión fiscal dentro del marco previsto', 'Cumplimiento de metas fiscales', 'Riesgo de sostenibilidad de la deuda', 'Riesgo fiscal potencial', 'Incumplimiento de metas fiscales', 'Transparencia fiscal efectiva', 'Consolidación fiscal sostenida', 'Desviación del déficit fiscal'], 'scores': [0.8877148628234863, 0.8559179902076721, 0.8530840277671814, 0.8116613626480103, 0.6356452107429504, 0.4684620797634125, 0.46053019165992737, 0.3963572084903717]}"
