filename,year,date,announcement,page,paragraph_id,text,sentiment
Pronunciamiento-FinanzasPublicas2022-vF.pdf,2023.0,30 de junio de 2023,,8,44,"para el crecimiento del GNFGG y del gasto corriente del Gobierno General. Esto generó espacio para la ejecución de gastos no previstos en el presupuesto de apertura (medidas) por más de S/ 10 mil millones (aproximadamente 1 puntos porcentuales del PBI), sin incumplir las reglas fiscales de gasto. De este modo, si se excluyera de la contabilidad de las reglas fiscales aquellos gastos en medidas que son de naturaleza transitoria, el GNFFF hubiese crecido 8,4 por ciento en términos reales y el gasto corriente sin mantenimiento hubiese crecido 5,3 por ciento en términos reales, por encima en ambos casos de los límites establecidos en las reglas fiscales vigentes (límites de 5,2 y 3,2 por ciento real, respectivamente). Considerando que para los próximos años se tiene prevista una senda de consolidación fiscal, el CF considera que limitar el crecimiento de los gastos de naturaleza más permanente (sin medidas) a los parámetros de las reglas fiscales de gasto, al tiempo que se mejora su eficiencia, facilitará el cumplimiento de aquel objetivo. Del mismo modo, el CF nota que, por el diseño de las reglas fiscales de gasto, los gastos temporales o extraordinarios brindan espacio en el año fiscal siguiente para acomodar mayores gastos, lo que permite extender la temporalidad de los desvíos. En ese sentido, una revisión futura del diseño de las reglas fiscales podría contemplar mecanismos que resuelvan dicho problema.","{'sequence': 'para el crecimiento del GNFGG y del gasto corriente del Gobierno General. Esto generó espacio para la ejecución de gastos no previstos en el presupuesto de apertura (medidas) por más de S/ 10 mil millones (aproximadamente 1 puntos porcentuales del PBI), sin incumplir las reglas fiscales de gasto. De este modo, si se excluyera de la contabilidad de las reglas fiscales aquellos gastos en medidas que son de naturaleza transitoria, el GNFFF hubiese crecido 8,4 por ciento en términos reales y el gasto corriente sin mantenimiento hubiese crecido 5,3 por ciento en términos reales, por encima en ambos casos de los límites establecidos en las reglas fiscales vigentes (límites de 5,2 y 3,2 por ciento real, respectivamente). Considerando que para los próximos años se tiene prevista una senda de consolidación fiscal, el CF considera que limitar el crecimiento de los gastos de naturaleza más permanente (sin medidas) a los parámetros de las reglas fiscales de gasto, al tiempo que se mejora su eficiencia, facilitará el cumplimiento de aquel objetivo. Del mismo modo, el CF nota que, por el diseño de las reglas fiscales de gasto, los gastos temporales o extraordinarios brindan espacio en el año fiscal siguiente para acomodar mayores gastos, lo que permite extender la temporalidad de los desvíos. En ese sentido, una revisión futura del diseño de las reglas fiscales podría contemplar mecanismos que resuelvan dicho problema.', 'labels': ['Gestión fiscal dentro del marco previsto', 'Mejora en calidad del gasto público', 'Incumplimiento severo de metas fiscales', 'Consolidación fiscal sostenida', 'Cumplimiento de metas fiscales', 'Transparencia fiscal efectiva', 'Alta incertidumbre macrofiscal', 'Riesgo fiscal potencial', 'Inestabilidad institucional moderada', 'Sostenibilidad fiscal sin observaciones', 'Desviación leve del déficit fiscal', 'Riesgo de sostenibilidad de la deuda'], 'scores': [0.9343610405921936, 0.7296150922775269, 0.654793918132782, 0.5843316316604614, 0.5418184399604797, 0.4778399169445038, 0.46505075693130493, 0.46038275957107544, 0.3942294120788574, 0.3854219615459442, 0.268737256526947, 0.2257959544658661]}"
Pronunciamiento-FinanzasPublicas2022-vF.pdf,2023.0,30 de junio de 2023,,8,46,"El CF nota que la reducción del resultado primario de las empresas públicas no financieras en 2022 (0,3 puntos porcentuales del PBI) atenuó la reducción del déficit fiscal en dicho año y se explicó, principalmente, por el deterioro del resultado primario de Petroperú (0,2 puntos porcentuales del PBI). Ante ello, el CF reitera su recomendación de monitorear e informar oportunamente, con la mayor transparencia posible, la situación financiera de Petroperú, en especial considerando que el gobierno otorgó un apoyo financiero significativo a la empresa estatal a lo largo del 2022.","{'sequence': 'El CF nota que la reducción del resultado primario de las empresas públicas no financieras en 2022 (0,3 puntos porcentuales del PBI) atenuó la reducción del déficit fiscal en dicho año y se explicó, principalmente, por el deterioro del resultado primario de Petroperú (0,2 puntos porcentuales del PBI). Ante ello, el CF reitera su recomendación de monitorear e informar oportunamente, con la mayor transparencia posible, la situación financiera de Petroperú, en especial considerando que el gobierno otorgó un apoyo financiero significativo a la empresa estatal a lo largo del 2022.', 'labels': ['Transparencia fiscal efectiva', 'Gestión fiscal dentro del marco previsto', 'Desviación leve del déficit fiscal', 'Incumplimiento severo de metas fiscales', 'Cumplimiento de metas fiscales', 'Inestabilidad institucional moderada', 'Mejora en calidad del gasto público', 'Riesgo fiscal potencial', 'Riesgo de sostenibilidad de la deuda', 'Alta incertidumbre macrofiscal', 'Consolidación fiscal sostenida', 'Sostenibilidad fiscal sin observaciones'], 'scores': [0.9532271027565002, 0.9041664600372314, 0.650478184223175, 0.6303806304931641, 0.607319712638855, 0.5480075478553772, 0.47350457310676575, 0.4481501877307892, 0.40760335326194763, 0.3454147279262543, 0.2378164827823639, 0.08736829459667206]}"
Pronunciamiento-FinanzasPublicas2022-vF.pdf,2023.0,30 de junio de 2023,,9,49,"El CF considera que la recomposición del FEF y la RSL registrada en 2022 representa un paso favorable para la recuperación de las cuentas fiscales luego de la pandemia, pues contar disponibilidad de activos líquidos es conveniente para la atención oportuna de posibles crisis futuras de envergadura. A pesar de la recuperación de activos financieros estratégicos, el CF considera que regresar a la situación fiscal prepandemia, en términos de endeudamiento neto, será retador y requerirá de un largo esfuerzo de consolidación fiscal en el mediano y largo plazo, además de medidas que favorezcan un crecimiento sostenido de la economía.","{'sequence': 'El CF considera que la recomposición del FEF y la RSL registrada en 2022 representa un paso favorable para la recuperación de las cuentas fiscales luego de la pandemia, pues contar disponibilidad de activos líquidos es conveniente para la atención oportuna de posibles crisis futuras de envergadura. A pesar de la recuperación de activos financieros estratégicos, el CF considera que regresar a la situación fiscal prepandemia, en términos de endeudamiento neto, será retador y requerirá de un largo esfuerzo de consolidación fiscal en el mediano y largo plazo, además de medidas que favorezcan un crecimiento sostenido de la economía.', 'labels': ['Consolidación fiscal sostenida', 'Gestión fiscal dentro del marco previsto', 'Cumplimiento de metas fiscales', 'Inestabilidad institucional moderada', 'Incumplimiento severo de metas fiscales', 'Transparencia fiscal efectiva', 'Desviación leve del déficit fiscal', 'Riesgo fiscal potencial', 'Alta incertidumbre macrofiscal', 'Mejora en calidad del gasto público', 'Riesgo de sostenibilidad de la deuda', 'Sostenibilidad fiscal sin observaciones'], 'scores': [0.9511903524398804, 0.8929058313369751, 0.816787838935852, 0.645950973033905, 0.6242054104804993, 0.6100404858589172, 0.5874286890029907, 0.5677455067634583, 0.5458770990371704, 0.5332669019699097, 0.5293304324150085, 0.21358180046081543]}"
Pronunciamiento-FinanzasPublicas2022-vF.pdf,2023.0,30 de junio de 2023,,9,51,"Considerando que ese programa ha estado sujeto a reprogramaciones y que todavía existen garantías vigentes, el CF opina que Reactiva Perú representa un riesgo fiscal relevante que debe ser monitoreado y transparentado, y cuya trayectoria debe ser parte de los reportes sobre riesgos fiscales emitidos por el MEF.","{'sequence': 'Considerando que ese programa ha estado sujeto a reprogramaciones y que todavía existen garantías vigentes, el CF opina que Reactiva Perú representa un riesgo fiscal relevante que debe ser monitoreado y transparentado, y cuya trayectoria debe ser parte de los reportes sobre riesgos fiscales emitidos por el MEF.', 'labels': ['Riesgo fiscal potencial', 'Gestión fiscal dentro del marco previsto', 'Riesgo de sostenibilidad de la deuda', 'Cumplimiento de metas fiscales', 'Incumplimiento severo de metas fiscales', 'Mejora en calidad del gasto público', 'Alta incertidumbre macrofiscal', 'Inestabilidad institucional moderada', 'Transparencia fiscal efectiva', 'Desviación leve del déficit fiscal', 'Sostenibilidad fiscal sin observaciones', 'Consolidación fiscal sostenida'], 'scores': [0.9810440540313721, 0.7539849281311035, 0.5464992523193359, 0.18240156769752502, 0.1786113977432251, 0.16595914959907532, 0.09684760868549347, 0.089479461312294, 0.080850750207901, 0.0633939653635025, 0.005775911267846823, 0.004268069751560688]}"
Pronunciamiento-FinanzasPublicas2022-vF.pdf,2023.0,30 de junio de 2023,,10,54,"variaciones de gran magnitud, lo que las convierte en una fuente de ingresos poco predecible. Esta situación adquiere mayor relevancia debido a que las transferencias RRNN constituyen una fuente de financiamiento importante del gasto de capital subnacional. En este contexto, el CF reafirma su recomendación de evaluar la implementación de un mecanismo de estabilización de las transferencias RRNN, con el objetivo de brindar mayor predictibilidad de los gastos de capital de los gobiernos subnacionales.","{'sequence': 'variaciones de gran magnitud, lo que las convierte en una fuente de ingresos poco predecible. Esta situación adquiere mayor relevancia debido a que las transferencias RRNN constituyen una fuente de financiamiento importante del gasto de capital subnacional. En este contexto, el CF reafirma su recomendación de evaluar la implementación de un mecanismo de estabilización de las transferencias RRNN, con el objetivo de brindar mayor predictibilidad de los gastos de capital de los gobiernos subnacionales.', 'labels': ['Gestión fiscal dentro del marco previsto', 'Riesgo fiscal potencial', 'Transparencia fiscal efectiva', 'Alta incertidumbre macrofiscal', 'Mejora en calidad del gasto público', 'Consolidación fiscal sostenida', 'Cumplimiento de metas fiscales', 'Inestabilidad institucional moderada', 'Desviación leve del déficit fiscal', 'Incumplimiento severo de metas fiscales', 'Riesgo de sostenibilidad de la deuda', 'Sostenibilidad fiscal sin observaciones'], 'scores': [0.8015762567520142, 0.5838301777839661, 0.5191693902015686, 0.43208959698677063, 0.3979751467704773, 0.39774900674819946, 0.39700353145599365, 0.3675065040588379, 0.22815683484077454, 0.18594391644001007, 0.14323966205120087, 0.0642310231924057]}"
Pronunciamiento-FinanzasPublicas2022-vF.pdf,2023.0,30 de junio de 2023,,10,55,"En cuanto al cumplimiento de las reglas fiscales subnacionales, el CF destaca nuevamente la existencia de un grupo de 32 gobiernos locales que vienen incumpliendo la regla de SDT desde la implementación del MRTF-SN en 2017. Estos gobiernos locales representan más de la mitad de los gobiernos locales que incumplieron dicha regla fiscal en 2022. Asimismo, estos gobiernos locales concentraron el 31,2 por ciento de toda la deuda en este nivel de gobierno. Frente a esta situación recurrente y que el CF ha venido alertando, el CF reafirma la necesidad de evaluar la implementación de mecanismos focalizados que permitan prevenir escenarios de insolvencia en dichas jurisdicciones, que podrían afectar negativamente la provisión de servicios públicos para más de 3 millones de personas residentes.","{'sequence': 'En cuanto al cumplimiento de las reglas fiscales subnacionales, el CF destaca nuevamente la existencia de un grupo de 32 gobiernos locales que vienen incumpliendo la regla de SDT desde la implementación del MRTF-SN en 2017. Estos gobiernos locales representan más de la mitad de los gobiernos locales que incumplieron dicha regla fiscal en 2022. Asimismo, estos gobiernos locales concentraron el 31,2 por ciento de toda la deuda en este nivel de gobierno. Frente a esta situación recurrente y que el CF ha venido alertando, el CF reafirma la necesidad de evaluar la implementación de mecanismos focalizados que permitan prevenir escenarios de insolvencia en dichas jurisdicciones, que podrían afectar negativamente la provisión de servicios públicos para más de 3 millones de personas residentes.', 'labels': ['Incumplimiento severo de metas fiscales', 'Gestión fiscal dentro del marco previsto', 'Riesgo fiscal potencial', 'Cumplimiento de metas fiscales', 'Riesgo de sostenibilidad de la deuda', 'Desviación leve del déficit fiscal', 'Mejora en calidad del gasto público', 'Inestabilidad institucional moderada', 'Transparencia fiscal efectiva', 'Alta incertidumbre macrofiscal', 'Consolidación fiscal sostenida', 'Sostenibilidad fiscal sin observaciones'], 'scores': [0.8814513683319092, 0.8242522478103638, 0.5486031770706177, 0.5339704155921936, 0.5041017532348633, 0.49984341859817505, 0.4553509056568146, 0.439666211605072, 0.3948279023170471, 0.36971667408943176, 0.21779987215995789, 0.1732463240623474]}"
Pronunciamiento-FinanzasPublicas2022-vF.pdf,2023.0,30 de junio de 2023,,11,57,"financiera. Por estos motivos, el CF reitera su recomendación de no considerar solamente la calificación crediticia de las entidades subnacionales como un parámetro para estar exento de las reglas fiscales subnacionales. Adicionalmente, el CF expresa su preocupación ante la potencial materialización de posibles contingencias o de nuevas operaciones de endeudamiento que podrían afectar aún más la situación fiscal de la MML. Por estos motivos, considerando la relevancia fiscal y social de la MML, el CF recomienda a la propia municipalidad a realizar un monitoreo pormenorizado y constante de su situación fiscal, para evitar situaciones que puedan afectar la provisión de servicios públicos a la ciudadanía.","{'sequence': 'financiera. Por estos motivos, el CF reitera su recomendación de no considerar solamente la calificación crediticia de las entidades subnacionales como un parámetro para estar exento de las reglas fiscales subnacionales. Adicionalmente, el CF expresa su preocupación ante la potencial materialización de posibles contingencias o de nuevas operaciones de endeudamiento que podrían afectar aún más la situación fiscal de la MML. Por estos motivos, considerando la relevancia fiscal y social de la MML, el CF recomienda a la propia municipalidad a realizar un monitoreo pormenorizado y constante de su situación fiscal, para evitar situaciones que puedan afectar la provisión de servicios públicos a la ciudadanía.', 'labels': ['Gestión fiscal dentro del marco previsto', 'Cumplimiento de metas fiscales', 'Riesgo fiscal potencial', 'Transparencia fiscal efectiva', 'Consolidación fiscal sostenida', 'Alta incertidumbre macrofiscal', 'Riesgo de sostenibilidad de la deuda', 'Mejora en calidad del gasto público', 'Inestabilidad institucional moderada', 'Incumplimiento severo de metas fiscales', 'Desviación leve del déficit fiscal', 'Sostenibilidad fiscal sin observaciones'], 'scores': [0.8290040493011475, 0.7780787944793701, 0.7353753447532654, 0.7018517255783081, 0.5626159310340881, 0.5189206004142761, 0.5173746943473816, 0.5026161670684814, 0.4974287450313568, 0.46250513195991516, 0.4299609363079071, 0.05702527239918709]}"
Pronunciamiento-FinanzasPublicas2022-vF.pdf,2023.0,30 de junio de 2023,,11,60,"Respecto del gasto no financiero público, el CF observa que el cumplimiento de las reglas fiscales del gasto no financiero y del gasto corriente sin mantenimiento, fue facilitado por la ejecución, en el año fiscal previo, de altos niveles de gastos temporales asociados a la pandemia de la COVID-19 que elevó la base de comparación. El CF también nota que, si se considerara el gasto sin medidas para los años 2021 y 2022, el gasto ejecutado crecería por encima de los parámetros máximos establecidos para ambas reglas fiscales. En ese sentido, el CF sugiere hacer un control estricto del gasto sin medidas a partir del ejercicio fiscal 2023 para facilitar el cumplimiento de la senda de consolidación fiscal prevista para el mediano plazo, la cual prevé una racionalización importante de los niveles de gasto.","{'sequence': 'Respecto del gasto no financiero público, el CF observa que el cumplimiento de las reglas fiscales del gasto no financiero y del gasto corriente sin mantenimiento, fue facilitado por la ejecución, en el año fiscal previo, de altos niveles de gastos temporales asociados a la pandemia de la COVID-19 que elevó la base de comparación. El CF también nota que, si se considerara el gasto sin medidas para los años 2021 y 2022, el gasto ejecutado crecería por encima de los parámetros máximos establecidos para ambas reglas fiscales. En ese sentido, el CF sugiere hacer un control estricto del gasto sin medidas a partir del ejercicio fiscal 2023 para facilitar el cumplimiento de la senda de consolidación fiscal prevista para el mediano plazo, la cual prevé una racionalización importante de los niveles de gasto.', 'labels': ['Gestión fiscal dentro del marco previsto', 'Cumplimiento de metas fiscales', 'Consolidación fiscal sostenida', 'Transparencia fiscal efectiva', 'Inestabilidad institucional moderada', 'Riesgo fiscal potencial', 'Mejora en calidad del gasto público', 'Desviación leve del déficit fiscal', 'Alta incertidumbre macrofiscal', 'Incumplimiento severo de metas fiscales', 'Riesgo de sostenibilidad de la deuda', 'Sostenibilidad fiscal sin observaciones'], 'scores': [0.881942868232727, 0.8261897563934326, 0.6016525626182556, 0.4953862726688385, 0.4671900272369385, 0.4518105387687683, 0.45131075382232666, 0.38154053688049316, 0.36501699686050415, 0.3462304174900055, 0.25710663199424744, 0.1862734705209732]}"
Pronunciamiento-FinanzasPublicas2022-vF.pdf,2023.0,30 de junio de 2023,,12,65,"Con relación a la evolución de las finanzas de los gobiernos subnacionales, el CF reitera su recomendación acerca de la implementación de un mecanismo de estabilización para los ingresos asociados a RRNN, con el objetivo de mejorar la previsibilidad y sostenibilidad de los gastos de capital, los cuales dependen en gran medida de esta fuente de financiamiento. Sobre el cumplimiento de las reglas fiscales aplicables a gobiernos regionales y locales, el CF resalta, una vez más, la existencia de un grupo de gobiernos locales con altos niveles de endeudamiento que vienen incumpliendo de manera recurrente la regla fiscal del SDT desde 2017. Por ello, el CF considera importante insistir en la necesidad de implementar mecanismos focalizados que permitan prevenir escenarios de insolvencia en dichas jurisdicciones que puedan afectar su capacidad de prestar servicios públicos a la población.","{'sequence': 'Con relación a la evolución de las finanzas de los gobiernos subnacionales, el CF reitera su recomendación acerca de la implementación de un mecanismo de estabilización para los ingresos asociados a RRNN, con el objetivo de mejorar la previsibilidad y sostenibilidad de los gastos de capital, los cuales dependen en gran medida de esta fuente de financiamiento. Sobre el cumplimiento de las reglas fiscales aplicables a gobiernos regionales y locales, el CF resalta, una vez más, la existencia de un grupo de gobiernos locales con altos niveles de endeudamiento que vienen incumpliendo de manera recurrente la regla fiscal del SDT desde 2017. Por ello, el CF considera importante insistir en la necesidad de implementar mecanismos focalizados que permitan prevenir escenarios de insolvencia en dichas jurisdicciones que puedan afectar su capacidad de prestar servicios públicos a la población.', 'labels': ['Incumplimiento severo de metas fiscales', 'Cumplimiento de metas fiscales', 'Mejora en calidad del gasto público', 'Gestión fiscal dentro del marco previsto', 'Desviación leve del déficit fiscal', 'Riesgo fiscal potencial', 'Riesgo de sostenibilidad de la deuda', 'Transparencia fiscal efectiva', 'Consolidación fiscal sostenida', 'Inestabilidad institucional moderada', 'Alta incertidumbre macrofiscal', 'Sostenibilidad fiscal sin observaciones'], 'scores': [0.9724488854408264, 0.9233304858207703, 0.9228844046592712, 0.857370138168335, 0.6610734462738037, 0.6059494614601135, 0.5961291790008545, 0.5881482362747192, 0.581531822681427, 0.5754827260971069, 0.546949565410614, 0.12183532863855362]}"
Pronunciamiento-FinanzasPublicas2022-vF.pdf,2023.0,30 de junio de 2023,,12,66,"Finalmente, el CF reitera que no considera adecuado exceptuar del cumplimiento de las reglas fiscales subnacionales a gobiernos regionales o locales en función únicamente de calificaciones crediticias, como es el caso de la Municipalidad Metropolitana de Lima (MML). Al respecto debe considerarse que las calificadoras de riesgo solo consideran la deuda financiera de la entidad a evaluar y suponen que el Gobierno Nacional actuará como garante (implícito) en situaciones de escasa capacidad de pago de la entidad subnacional evaluada. Asimismo, el CF expresa su preocupación por el posible incremento de la deuda de la MML, debido a la potencial materialización de contingencias. Por ello, considerando que la relevancia social y fiscal de la MML, el CF recomienda a la propia municipalidad a realizar un monitoreo constante de su situación fiscal.","{'sequence': 'Finalmente, el CF reitera que no considera adecuado exceptuar del cumplimiento de las reglas fiscales subnacionales a gobiernos regionales o locales en función únicamente de calificaciones crediticias, como es el caso de la Municipalidad Metropolitana de Lima (MML). Al respecto debe considerarse que las calificadoras de riesgo solo consideran la deuda financiera de la entidad a evaluar y suponen que el Gobierno Nacional actuará como garante (implícito) en situaciones de escasa capacidad de pago de la entidad subnacional evaluada. Asimismo, el CF expresa su preocupación por el posible incremento de la deuda de la MML, debido a la potencial materialización de contingencias. Por ello, considerando que la relevancia social y fiscal de la MML, el CF recomienda a la propia municipalidad a realizar un monitoreo constante de su situación fiscal.', 'labels': ['Gestión fiscal dentro del marco previsto', 'Cumplimiento de metas fiscales', 'Riesgo de sostenibilidad de la deuda', 'Riesgo fiscal potencial', 'Incumplimiento severo de metas fiscales', 'Mejora en calidad del gasto público', 'Alta incertidumbre macrofiscal', 'Transparencia fiscal efectiva', 'Desviación leve del déficit fiscal', 'Consolidación fiscal sostenida', 'Inestabilidad institucional moderada', 'Sostenibilidad fiscal sin observaciones'], 'scores': [0.8877148628234863, 0.8559179902076721, 0.8530840277671814, 0.8116613626480103, 0.6455280780792236, 0.5484970808029175, 0.502632200717926, 0.4684620797634125, 0.4632028639316559, 0.46053019165992737, 0.4363399147987366, 0.22390882670879364]}"
Comunicado-012024-RiesgosFiscales-v4-1.pdf,2024.0,1 de febrero de 2024,,1,1,"El Consejo Fiscal, con el objeto de contribuir con la gestión transparente y responsable de la política fiscal, a través de un análisis técnico e independiente, considera oportuno alertar sobre un conjunto de riesgos que deben ser abordados por las autoridades fiscales en el corto y mediano plazo, para mitigar su potencial impacto en la credibilidad y sostenibilidad fiscales del país.","{'sequence': 'El Consejo Fiscal, con el objeto de contribuir con la gestión transparente y responsable de la política fiscal, a través de un análisis técnico e independiente, considera oportuno alertar sobre un conjunto de riesgos que deben ser abordados por las autoridades fiscales en el corto y mediano plazo, para mitigar su potencial impacto en la credibilidad y sostenibilidad fiscales del país.', 'labels': ['Riesgo fiscal potencial', 'Transparencia fiscal efectiva', 'Gestión fiscal dentro del marco previsto', 'Inestabilidad institucional moderada', 'Riesgo de sostenibilidad de la deuda', 'Consolidación fiscal sostenida', 'Alta incertidumbre macrofiscal', 'Cumplimiento de metas fiscales', 'Incumplimiento severo de metas fiscales', 'Desviación leve del déficit fiscal', 'Mejora en calidad del gasto público', 'Sostenibilidad fiscal sin observaciones'], 'scores': [0.910551905632019, 0.7838571071624756, 0.6518974304199219, 0.5804001688957214, 0.445696622133255, 0.3666568398475647, 0.3654734790325165, 0.35206159949302673, 0.3390335738658905, 0.30312439799308777, 0.2245825082063675, 0.010409669950604439]}"
